source_platform,app_id,review_id,review_text,rating,review_date,app_version,thumbs_up_count,developer_response,collected_at
Google Play,com.duolingo,77c5bdb4-ba4d-4f13-b096-065534191ac0,good,5,2026-05-18 23:10:50,6.79.5,0,,2026-05-20T03:11:02.643813+00:00
Google Play,com.duolingo,14fc0306-259f-43cc-9606-be6d7cb8349e,because it have fun and lovely game.,5,2026-05-18 23:09:56,6.79.5,0,,2026-05-20T03:11:02.643813+00:00
Google Play,com.duolingo,e48ffa83-77e6-4a26-bcbf-245e32937ea2,it's good for beginners wanting to improve their vocabulary but after doing it for a year I realized my conversational skills hadn't increased at all. I'm switching to babbel,2,2026-05-18 23:09:45,6.42.6,0,,2026-05-20T03:11:02.643813+00:00
Google Play,com.duolingo,09f0767e-6e7d-4b38-9802-a8274b6fec27,"Estaba revisando el perfil de mi amigo, toqué sin querer el botón de dejar de seguir y la app lo procesó al instante, sin preguntar. Perdimos nuestra racha de inmediato y me dio mucha pena, al punto de perder la motivación para seguir usando la app :(. Por favor, agreguen un botón de confirmación para evitar estos accidentes. Soporte, si leen esto ayuden a esta pobre alma a recuperar su racha con su amigo, por favor :((( le pongo dos estrellas porque me dio mucha pena",2,2026-05-18 23:05:56,6.79.5,0,,2026-05-20T03:11:02.643813+00:00
Google Play,com.duolingo,61cbbc7e-70fc-4b70-b354-38598e2bb8ff,very nice,5,2026-05-18 23:04:52,6.79.5,0,,2026-05-20T03:11:02.643813+00:00
Google Play,com.duolingo,166bf1bb-b2c9-40a6-bbbd-f5270a7ade52,Classic,5,2026-05-18 23:04:52,6.78.4,0,,2026-05-20T03:11:02.643813+00:00
Google Play,com.duolingo,b16f72d3-3bf4-45ce-bb9a-165f84b95bd3,it's good for those of us on a budget. I look forward to my daily lessons. 😊,4,2026-05-18 23:00:08,6.79.5,0,,2026-05-20T03:11:02.643813+00:00
Google Play,com.duolingo,0b0c3857-26d9-4895-a735-d8c18a7e38be,This app is very useful to learn different languages and a game like we learning the languages,5,2026-05-18 23:00:06,,0,,2026-05-20T03:11:02.643813+00:00
Google Play,com.duolingo,0a153b88-ccb4-4a0d-9916-75bb89121747,baping,5,2026-05-18 22:55:50,6.79.5,0,,2026-05-20T03:11:02.643813+00:00
Google Play,com.duolingo,9f8671a0-1c86-4b1d-a808-3272e7b74f26,totally nice I like it.,5,2026-05-18 22:53:19,6.79.5,0,,2026-05-20T03:11:02.643813+00:00
Google Play,com.duolingo,1fbeeb10-0afd-47b1-8a84-a91bd25f26f2,I learned really well for music!5 stars!,5,2026-05-18 22:52:37,6.79.5,0,,2026-05-20T03:11:02.643813+00:00
Google Play,com.duolingo,89a04d2e-face-4c13-aef2-e981901fb4cc,it's make me fun and I'm so happy to learn with Duolingo.,5,2026-05-18 22:49:43,6.79.5,0,,2026-05-20T03:11:02.643813+00:00
Google Play,com.duolingo,20854a20-ff01-49dc-baec-aea46546e56b,👍,5,2026-05-18 22:49:29,6.79.5,0,,2026-05-20T03:11:02.643813+00:00
Google Play,com.duolingo,2fd91db7-d116-4c4a-9f25-d4dc1eaafb5b,perfect app,5,2026-05-18 22:48:09,6.79.5,0,,2026-05-20T03:11:02.643813+00:00
Google Play,com.duolingo,42893442-a517-475a-b5cd-75c3ffb485a5,seru banget aku jadi bisa hapal bahasa Inggris,5,2026-05-18 22:46:43,6.79.5,0,,2026-05-20T03:11:02.643813+00:00
Google Play,com.duolingo,8dad1d20-cdbc-4866-b28b-b01670b815aa,apur,5,2026-05-18 22:45:14,6.79.5,0,,2026-05-20T03:11:02.643813+00:00
Google Play,com.duolingo,8041e672-bb8e-4be7-a42c-101551cff342,its going to be so helpful if I go to Japan I will understand what people are saying and I can communicate,5,2026-05-18 22:44:11,6.78.4,0,,2026-05-20T03:11:02.643813+00:00
Google Play,com.duolingo,5063a96d-32fb-4885-9cf0-77354f0eb425,"Wish there were more in depth grammar explanations for the various languages. Took 2 years Spanish in high school and refreshed through this ap a few years ago, but switching to Norwegian and not having a layout of grammar isn't helpful to me. Would also like to have numbers in the beginning of the intro to languages before jumping straight into having to guess the words",3,2026-05-18 22:43:29,,0,,2026-05-20T03:11:02.643813+00:00
Google Play,com.duolingo,83abd790-ad2d-4f2d-99a7-54a0e3249cf4,I'm learning a lot,5,2026-05-18 22:43:14,6.79.5,0,,2026-05-20T03:11:02.643813+00:00
Google Play,com.duolingo,edba96b3-d747-4851-a367-23e653c8a16a,good,5,2026-05-18 22:42:26,6.79.5,0,,2026-05-20T03:11:02.643813+00:00
Google Play,com.duolingo,140e13dc-b275-4069-9aa6-f9e884e186dc,Duolingo is the best app of language learning! It's known for it's lessons and it's making my studies easy since I was in the 4th class,5,2026-05-18 22:41:50,6.79.5,0,,2026-05-20T03:11:02.643813+00:00
Google Play,com.duolingo,95a261bd-b40a-443f-994a-3fd7de8a1fa2,this app is so much fun and reminds me to study every day,5,2026-05-18 22:41:42,6.79.5,0,,2026-05-20T03:11:02.643813+00:00
Google Play,com.duolingo,d1520478-b875-4477-8c15-6cff38c70cd0,very good,5,2026-05-18 22:40:45,6.79.5,0,,2026-05-20T03:11:02.643813+00:00
Google Play,com.duolingo,a89875d7-60e9-4319-b6ba-92aead3bd7f9,great English learing fun to learn and just like a game,5,2026-05-18 22:40:02,6.79.5,0,,2026-05-20T03:11:02.643813+00:00
Google Play,com.duolingo,c7918401-8d32-4da9-aabc-5c0e39fb0c3b,app is very useful 😁,5,2026-05-18 22:37:17,6.79.5,0,,2026-05-20T03:11:02.643813+00:00
Google Play,com.duolingo,ac6de4c0-e2e2-437f-b5b4-df66337dc7f4,very good app,5,2026-05-18 22:36:39,,0,,2026-05-20T03:11:02.643813+00:00
Google Play,com.duolingo,78f704c5-c90c-4e06-993c-d00bc2002800,I like duolingo,5,2026-05-18 22:34:30,6.79.5,0,,2026-05-20T03:11:02.643813+00:00
Google Play,com.duolingo,671f0848-52ac-4094-b259-248aef157e21,I love this,5,2026-05-18 22:32:58,6.79.5,0,,2026-05-20T03:11:02.643813+00:00
Google Play,com.duolingo,08271c1b-82cf-4ac2-b7cb-9f856ab94a6b,it's nice to learn any language,5,2026-05-18 22:31:27,6.79.5,0,,2026-05-20T03:11:02.643813+00:00
Google Play,com.duolingo,184db27a-ed8b-4aee-83f1-a1b3bf679ab9,best app for new language learners.,4,2026-05-18 22:31:08,6.79.5,0,,2026-05-20T03:11:02.643813+00:00
Google Play,com.duolingo,8c834bad-7c07-4ac5-8328-b26f2399a0e0,Duolingo ignores glitches that I report.,1,2026-05-18 22:30:15,6.79.5,2,,2026-05-20T03:11:02.643813+00:00
Google Play,com.duolingo,b1fd7499-8cac-49e3-85e8-8bbcb76dc96b,just love it,5,2026-05-18 22:29:28,6.79.5,0,,2026-05-20T03:11:02.643813+00:00
Google Play,com.duolingo,343497f4-91cc-4c48-b5bd-ad6a27c8be4d,very good,3,2026-05-18 22:29:08,6.79.5,0,,2026-05-20T03:11:02.643813+00:00
Google Play,com.duolingo,5412de19-1944-4868-a490-acc349e1c415,ok naman pero bitin yung isang lingi lang dapat libre nalang himdi yung yung isang lingo lang,4,2026-05-18 22:28:55,6.79.5,0,,2026-05-20T03:11:02.643813+00:00
Google Play,com.duolingo,a6cd7c09-f75e-4c59-ab7e-6c65f1186ed9,good 👍 for learning so many languages,5,2026-05-18 22:28:55,,0,,2026-05-20T03:11:02.643813+00:00
Google Play,com.duolingo,867486cf-7ec0-46e3-b47a-c2ddf8980de5,good for learning,5,2026-05-18 22:28:48,6.79.5,0,,2026-05-20T03:11:02.643813+00:00
Google Play,com.duolingo,9612a07b-e2af-4791-8f18-97248f17b812,it is a very good app for learning new language and music for travelling. I am learning korean because I want to go korea and talk with the people and there is many options I love it best ap ever,5,2026-05-18 22:27:55,6.79.5,0,,2026-05-20T03:11:02.643813+00:00
Google Play,com.duolingo,d95cc318-24a1-43d8-9317-5867b604fdcb,I loved it,5,2026-05-18 22:27:50,6.79.5,0,,2026-05-20T03:11:02.643813+00:00
Google Play,com.duolingo,1c67748d-1aa2-4254-9071-2196f8ebde16,"Six modules for a single level? Duo really structures their learning and sessions to ensure that you're on the app as long as humanly possible, rather than actually trying to efficiently teach you a language. Business over purpose. An enjoyable waste of time.",1,2026-05-18 22:26:43,6.79.5,0,,2026-05-20T03:11:02.643813+00:00
Google Play,com.duolingo,d423b480-4319-487d-8e1d-5eb0a058395f,Duolingo apps can improve your English if you want to improve your English so can everything,5,2026-05-18 22:25:16,6.79.5,0,,2026-05-20T03:11:02.643813+00:00
Google Play,com.duolingo,28760fb5-113b-4871-83b7-4cd7b55d4e64,amazing for learning overall use it. use it. USE IT NOW! YEAH!,5,2026-05-18 22:23:25,6.79.5,0,,2026-05-20T03:11:02.643813+00:00
Google Play,com.duolingo,dc6f13a0-77fc-4600-8689-bb1ef6eb1eb6,Stop updating things I'm in the middle of and then messing up my progress. Total garbage.,1,2026-05-18 22:22:42,6.79.5,13,,2026-05-20T03:11:02.643813+00:00
Google Play,com.duolingo,931e4e77-e2c3-44a0-82a7-f9fffe8a28f3,good,5,2026-05-18 22:22:26,6.79.5,0,,2026-05-20T03:11:02.643813+00:00
Google Play,com.duolingo,97fcccbb-a923-47e0-b43f-d3c84378d30b,it is so easy to learn languages with it with it,5,2026-05-18 22:18:41,6.79.5,0,,2026-05-20T03:11:02.643813+00:00
Google Play,com.duolingo,25370813-830c-4f1a-91ab-1fb7bf699ad4,nice,5,2026-05-18 22:17:49,6.79.5,0,,2026-05-20T03:11:02.643813+00:00
Google Play,com.duolingo,a0e6d250-e91e-47ad-b5cd-553d48655e45,best learning app,5,2026-05-18 22:17:17,6.79.5,0,,2026-05-20T03:11:02.643813+00:00
Google Play,com.duolingo,0e379ba8-af26-4014-86ec-0cbaeb3a64d7,😇,4,2026-05-18 22:17:08,6.79.5,0,,2026-05-20T03:11:02.643813+00:00
Google Play,com.duolingo,ee340de9-6ed8-43fb-bbeb-ad16dee16163,Duolingo,2,2026-05-18 22:16:04,6.79.5,0,,2026-05-20T03:11:02.643813+00:00
Google Play,com.duolingo,0f03af50-347e-4e71-b122-1a883d88ece7,it well help people achieve their goals,5,2026-05-18 22:15:09,6.79.5,0,,2026-05-20T03:11:02.643813+00:00
Google Play,com.duolingo,04d70785-7b0a-46f2-b9bd-a59b502029cf,nice app,5,2026-05-18 22:14:34,6.79.5,0,,2026-05-20T03:11:02.643813+00:00
Google Play,com.duolingo,2d06bcc5-d741-4d12-8fef-58016f97b4a5,good idea,5,2026-05-18 22:13:23,6.79.5,0,,2026-05-20T03:11:02.643813+00:00
Google Play,com.duolingo,b9dfa20b-c474-4176-84d1-fd4f96c47d5b,the Best,5,2026-05-18 22:11:48,6.79.5,0,,2026-05-20T03:11:02.643813+00:00
Google Play,com.duolingo,dc8e3d7b-a26d-4a2c-b0e7-01f322452e94,Besst,5,2026-05-18 22:11:02,6.79.5,0,,2026-05-20T03:11:02.643813+00:00
Google Play,com.duolingo,fcaa8910-9f7a-4f0e-a1fc-ef9aa69a1dcc,"EDIT: The app is aggressive. If this isn't fixed, I'm uninstalling.",1,2026-05-18 22:10:59,,0,,2026-05-20T03:11:02.643813+00:00
Google Play,com.duolingo,0c360a5b-d689-42f6-9de8-cd009c5f3f22,nice app and firs a fol my english is very week but does day a try to My best and approve by english cualcher in this app..,5,2026-05-18 22:10:38,6.79.5,0,,2026-05-20T03:11:02.643813+00:00
Google Play,com.duolingo,d66fc9c2-c4fc-41f4-84bf-08af42585b07,this is actually helping me learn you should try it,5,2026-05-18 22:10:04,6.78.4,0,,2026-05-20T03:11:02.643813+00:00
Google Play,com.duolingo,ff6882eb-ce08-4178-8e2a-2f0a044d3965,"This is no longer a language app. It is an advertising app that will allow you to learn languages when the advertisements are not running. In its current state, you spend more time watching adds than you spend learning.",2,2026-05-18 22:07:57,6.79.5,0,,2026-05-20T03:11:02.643813+00:00
Google Play,com.duolingo,e0ffb6eb-d6be-4ecb-899c-b3d8bf99ad7c,thanks for your time and I will send it to the following link to my name is Isha sen touch with me to the next day or night my love for your help and advice and guidance and guidance on what you want me too I and guidance of Dr is assigned the following file and I will have a nice day and advice and I am looking for your email and any attachments may be a good idea for your time in a good idea for a few days ago I will have to the following URL Adobe the following finish,4,2026-05-18 22:06:45,,0,,2026-05-20T03:11:02.643813+00:00
Google Play,com.duolingo,b44cd65d-248d-462f-8851-63db6c1a995b,bahut achcha app hai. isse aasani mein English Sikh sakte hain,5,2026-05-18 22:06:43,6.79.5,0,,2026-05-20T03:11:02.643813+00:00
Google Play,com.duolingo,eafcfea5-4bd9-487b-ac19-7b65c9fb74d8,I really like this,5,2026-05-18 22:03:56,6.79.5,0,,2026-05-20T03:11:02.643813+00:00
Google Play,com.duolingo,510f73c4-f143-456b-bf9f-47ba86122996,Good i am Heppest,5,2026-05-18 22:03:35,6.79.5,0,,2026-05-20T03:11:02.643813+00:00
Google Play,com.duolingo,1b94668d-f3b8-4a5c-a61c-c2d7bb373ee0,sorry if I edit it the rate but when I go see the app icon on the phone Duolingo gets mad after his app icon turns red and starts angry I quit using Duolingo and try out the other Duolingo apps 1 star for this one sorry...,1,2026-05-18 22:00:41,,0,,2026-05-20T03:11:02.643813+00:00
Google Play,com.duolingo,05b58295-c0f4-43af-ba25-97f02806f130,love it so much I have so many goals,4,2026-05-18 22:00:14,6.79.5,0,,2026-05-20T03:11:02.643813+00:00
Google Play,com.duolingo,882a1426-f144-4f10-aea2-78e1413dfc42,stupidity,1,2026-05-18 21:59:28,,0,,2026-05-20T03:11:02.643813+00:00
Google Play,com.duolingo,767948de-a681-4c2b-89a1-d1b8fb1993c3,It's too amazing 😍,5,2026-05-18 21:53:29,6.79.5,0,,2026-05-20T03:11:02.643813+00:00
Google Play,com.duolingo,2a7b8745-dd5d-4deb-946e-86f29e0c93eb,this aap is best I learn Japanese from this,5,2026-05-18 21:53:25,6.79.5,0,,2026-05-20T03:11:02.643813+00:00
Google Play,com.duolingo,b87f4b52-f143-47f6-bc2e-04d501d3040c,good reminder 😉,5,2026-05-18 21:53:09,6.79.5,0,,2026-05-20T03:11:02.643813+00:00
Google Play,com.duolingo,988fc119-04f6-4a1a-821a-8fd8d4b0f585,it's so good,2,2026-05-18 21:50:07,6.79.5,0,,2026-05-20T03:11:02.643813+00:00
Google Play,com.duolingo,a3d572ba-c410-4a62-a162-fd9fe6eddd7b,makes me ragebait sometimes but it's whatever I'm a kid trying to learns Spanish to communicate with my dads side. Duolingo is helping!,3,2026-05-18 21:49:31,6.79.5,0,,2026-05-20T03:11:02.643813+00:00
Google Play,com.duolingo,7bdd3034-9707-42b1-88ae-94125ec8c9fe,i love this! it make me understand more easy than before😌🤌,5,2026-05-18 21:49:14,6.79.5,0,,2026-05-20T03:11:02.643813+00:00
Google Play,com.duolingo,e69a5f2d-66c1-4d14-9772-f86f968fc39d,it's teaching me a lot and it's just a way to stay of youtube even if it's for just for 10 minutes,5,2026-05-18 21:47:45,6.79.5,0,,2026-05-20T03:11:02.643813+00:00
Google Play,com.duolingo,1137e947-96f0-4b92-90eb-2f913eb6bfe1,I think it's pretty good but mostly because well I wanna be a Scottish person to prank my friend,5,2026-05-18 21:47:39,6.79.5,0,,2026-05-20T03:11:02.643813+00:00
Google Play,com.duolingo,e8b811a3-143c-4d83-8987-150b62247909,during is great,5,2026-05-18 21:45:59,6.79.5,0,,2026-05-20T03:11:02.643813+00:00
Google Play,com.duolingo,be72b406-91be-4b9a-8eaa-134c29ee9e32,"Issue with canto being in a weird format, the line goes through my word choices",3,2026-05-18 21:44:19,6.79.5,1,,2026-05-20T03:11:02.643813+00:00
Google Play,com.duolingo,20f6ba2d-48cc-41d6-a065-5ef0712de2db,its learning methods are very easy,5,2026-05-18 21:43:20,6.79.5,0,,2026-05-20T03:11:02.643813+00:00
Google Play,com.duolingo,490b7552-9e45-4d83-ba95-fbd6e31f6ad2,perfect app to learn languages. I'm gonna impress my Polish best friend lol,5,2026-05-18 21:42:07,6.79.5,0,,2026-05-20T03:11:02.643813+00:00
Google Play,com.duolingo,c4122719-70b0-4ce1-bc04-3280da5d2f2f,I can learn korean and chess! I love it!,4,2026-05-18 21:41:45,6.79.5,0,,2026-05-20T03:11:02.643813+00:00
Google Play,com.duolingo,a93f2a23-7486-47fe-bc52-3d5862871fe1,very good app to learn about other languages,5,2026-05-18 21:40:31,6.79.5,0,,2026-05-20T03:11:02.643813+00:00
Google Play,com.duolingo,4ed50eae-80ad-4491-b103-af31644d517b,I'll love it I'm learning Spanish,5,2026-05-18 21:40:01,6.79.5,0,,2026-05-20T03:11:02.643813+00:00
Google Play,com.duolingo,b9db3970-af60-4a58-89fa-a7193c83e381,very good 👍 aap for children,5,2026-05-18 21:39:49,6.79.5,0,,2026-05-20T03:11:02.643813+00:00
Google Play,com.duolingo,1ae2f60e-c0ab-45b6-bbef-024a81358725,I Love the app,5,2026-05-18 21:32:07,6.79.5,0,,2026-05-20T03:11:02.643813+00:00
Google Play,com.duolingo,cbd5d3f8-45c6-45fc-a621-0d96132b628e,🤩🤩🤩🤩🤩,5,2026-05-18 21:31:44,6.79.5,0,,2026-05-20T03:11:02.643813+00:00
Google Play,com.duolingo,3a2c9de8-b30c-463f-be22-827ea630f846,ts app is so so so useful i can't have words to express its benifits amazing app😋🙏🏻,5,2026-05-18 21:31:17,5.121.15,0,,2026-05-20T03:11:02.643813+00:00
Google Play,com.duolingo,c5d12a44-cc10-4165-80f4-a714f8625196,Duolingo has helped me so much to improve my Spanish even though I am still a beginner duo has taught me so much and I can't wait to learn more Spanish the whole reason I wanted to learn Spanish was because I have a friend that speaks Spanish so personally I love Duolingo and think you will to☺️☺️,5,2026-05-18 21:26:49,6.79.5,0,,2026-05-20T03:11:02.643813+00:00
Google Play,com.duolingo,d0c13ffe-6827-4001-b1b1-6ab885363e3c,Puedo practicar en cualquier momento q tengo el tiempo,5,2026-05-18 21:26:25,6.79.5,0,,2026-05-20T03:11:02.643813+00:00
Google Play,com.duolingo,3f2e05c1-c58b-4118-86fc-ecfaff18d73a,i like this I can learn english and other languages here but one thing i don't give it five star because people say it's free but somethings are not free,4,2026-05-18 21:21:58,5.141.12,0,,2026-05-20T03:11:02.643813+00:00
Google Play,com.duolingo,ce475d38-abe8-494c-a0b2-9be9c5775068,Easy to learn,5,2026-05-18 21:21:32,6.79.5,0,,2026-05-20T03:11:02.643813+00:00
Google Play,com.duolingo,06e88142-1e54-43aa-96e6-d58f31d4246e,i been using it a lot and it helps a lot,4,2026-05-18 21:19:17,6.79.5,0,,2026-05-20T03:11:02.643813+00:00
Google Play,com.duolingo,fd81007f-d02f-4ff8-8195-3ddecffb93af,I downloaded it for my daughter and she new fluent Vietnamese and was so happy I was so happy for her tysm douo,5,2026-05-18 21:17:58,6.79.5,0,,2026-05-20T03:11:02.643813+00:00
Google Play,com.duolingo,fbec3db4-e332-4313-993e-b7645d97a4d2,amazing learning so much also so fun .,5,2026-05-18 21:17:00,6.79.5,0,,2026-05-20T03:11:02.643813+00:00
Google Play,com.duolingo,c8b9d754-3737-4a25-a903-0546beff6155,best game,5,2026-05-18 21:15:43,6.79.5,0,,2026-05-20T03:11:02.643813+00:00
Google Play,com.duolingo,aca727fe-c28b-46a7-a41b-bb4147a4973d,nice I'm learning Japanese,4,2026-05-18 21:06:54,6.79.5,0,,2026-05-20T03:11:02.643813+00:00
Google Play,com.duolingo,c1f4941d-377e-4ae0-a542-9e65136a0771,it`s very good 💯,5,2026-05-18 21:06:26,6.79.5,0,,2026-05-20T03:11:02.643813+00:00
Google Play,com.duolingo,ac451f95-d60f-4395-b180-32251b24d407,"I love this app so much who ever did not do this? You should do it, I love it. I'm doing korean",5,2026-05-18 21:04:51,6.79.5,0,,2026-05-20T03:11:02.643813+00:00
Google Play,com.duolingo,c7771640-04ff-4b73-a38f-1369637b692c,"stop ""updating"" the curriculum and skipping me ahead 5 sections. Nothing is more disheartening than seeing all my hard work was wasted. I have no idea any of the sentence structure now.",1,2026-05-18 21:03:22,6.79.5,0,,2026-05-20T03:11:02.643813+00:00
Google Play,com.duolingo,5b546972-9378-4ac0-b9b7-75fdb6c3dad5,"using this for vocal Chinese, no way to learn this language without forced hanzi (character) drawing. That's really too bad, not interested in the written skill, just in spoken. The app becomes useless to progress.",1,2026-05-18 21:03:04,6.79.5,0,,2026-05-20T03:11:02.643813+00:00
Google Play,com.duolingo,c6156a52-859e-4f24-a744-e26009841701,Very good for learning greek language.,5,2026-05-18 21:02:26,6.79.5,0,,2026-05-20T03:11:02.643813+00:00
Google Play,com.duolingo,b3eed749-9e64-4c46-8a79-0693acb3f734,A great app to learn a new language!,5,2026-05-18 21:01:53,6.79.5,0,,2026-05-20T03:11:02.643813+00:00
Google Play,com.duolingo,d3198ca2-16e7-42a0-957d-f70253c2ef5a,it's good and you learn a lot,5,2026-05-18 21:01:16,6.79.5,0,,2026-05-20T03:11:02.643813+00:00
Google Play,com.duolingo,e7bd23d6-de7b-4e20-8c74-c3c3cea95814,"THE ENERGY BAR IS WAY TOO IDIOTIC. Seriously, When one of the tasks said 4 lessons, I would just run out of energy, and I have to pay a random amount of gems just for that. Seriously, Duolingo, what were you thinking these days?👎🏻",1,2026-05-18 20:59:40,6.79.5,0,,2026-05-20T03:11:02.643813+00:00
Google Play,com.duolingo,fbcd28e4-d7d7-4246-8a41-ccb1c8a3f117,very good app first i am think that this also other like app to asking the money fiest but i was wrong because this is totaly free i just like very it understand us and trying to make improved so at last i want to say you also use this and rate on google how this app taugh us very good manner i don not have any word to explain about but i want to tell you this app is very good app thank you,5,2026-05-18 20:59:17,6.79.5,0,,2026-05-20T03:11:02.643813+00:00
Google Play,com.duolingo,09ee49b1-fb3e-49a6-8a61-3bc43a4f8ed4,I am new student but I feel Angel.,1,2026-05-18 20:59:06,6.79.5,0,,2026-05-20T03:11:02.643813+00:00
Google Play,com.duolingo,107b9745-ff03-4436-bb83-b85027891fa8,"this very nationaly educational,I love it!!",5,2026-05-18 20:57:41,6.79.5,0,,2026-05-20T03:11:02.643813+00:00
Google Play,com.duolingo,46b5fc1e-d92e-4212-bce1-7af8df490746,"Duolingo used to be the best language learning app. Now it’s a complete disaster. The developers destroyed everything that made it good. They removed the forums, offline lessons, the original tree, and the live practice communities. And as if that wasn’t enough, they replaced hearts with energy - the worst update ever. Now you can barely study for five minutes before the app stops you. It’s not about education anymore, it’s about money. Everyone’s deleting it. Don’t waste your time 😤",1,2026-05-18 20:52:24,4.90.3,1,,2026-05-20T03:11:02.643813+00:00
Google Play,com.duolingo,04168376-bfea-490f-b56c-1e387d26fc81,I think its great! It helping me learn Chinese and I like that I get to go back and fix my mistakes after done with the lesson if you don't have Duolingo get it now it's great!,4,2026-05-18 20:52:00,6.79.5,0,,2026-05-20T03:11:02.643813+00:00
Google Play,com.duolingo,6d682a85-3eb9-4112-ab1b-a5d3b882d3ad,"i have learnt a lot of Español, its really fun!~",5,2026-05-18 20:49:40,6.79.5,0,,2026-05-20T03:11:02.643813+00:00
Google Play,com.duolingo,32c46caf-62ef-47f2-8601-792af7da577c,good I prefer,5,2026-05-18 20:47:21,6.79.5,0,,2026-05-20T03:11:02.643813+00:00
Google Play,com.duolingo,32a9e79b-3f5c-4b3b-9576-c503a3c0c197,Android. No suits yet. Often it freezes showing a option frozen on the screen after passing round. Sometimes it freezes and have to restart it. Need better tech on android,2,2026-05-18 20:47:17,6.79.5,0,,2026-05-20T03:11:02.643813+00:00
Google Play,com.duolingo,ba9e4361-9abf-415a-82d5-6d0523058d50,it really helps ☺️ love this app ❤️🤩,5,2026-05-18 20:45:57,6.79.5,0,,2026-05-20T03:11:02.643813+00:00
Google Play,com.duolingo,9aed97b5-ec9c-4693-af30-d6c2d15a9cc7,Good😍😍,5,2026-05-18 20:43:00,5.141.11,1,,2026-05-20T03:11:02.643813+00:00
Google Play,com.duolingo,73411299-c2cd-4b31-a095-ebd007eeb6e0,"Please bring something through which we can directly message and communicate with our friends, so that learning becomes more interactive and enjoyable. 🙂",5,2026-05-18 20:42:03,6.79.5,1,,2026-05-20T03:11:02.643813+00:00
Google Play,com.duolingo,5c46fcdb-5027-4e19-9bb6-0716b9909f32,ok great practices,5,2026-05-18 20:33:36,6.78.4,0,,2026-05-20T03:11:02.643813+00:00
Google Play,com.duolingo,362889c9-24ef-46d8-a22c-b2ad94835a6c,its amazing I'm learning Russian,5,2026-05-18 20:30:43,5.121.15,0,,2026-05-20T03:11:02.643813+00:00
Google Play,com.duolingo,48187b68-1191-420c-8d93-5235efba4f7a,itz so good and anyone can learn any languages from any where and any device just for free,5,2026-05-18 20:29:10,6.79.5,0,,2026-05-20T03:11:02.643813+00:00
Google Play,com.duolingo,28a16196-06fe-4504-8ee3-e5cd37447051,easy to learn for now 😉,5,2026-05-18 20:29:00,6.79.5,0,,2026-05-20T03:11:02.643813+00:00
Google Play,com.duolingo,99122634-0f11-4642-9a56-c148c61f2b90,This app is very easy and good 👍👍😊,5,2026-05-18 20:24:40,6.79.5,0,,2026-05-20T03:11:02.643813+00:00
Google Play,com.duolingo,e6012e40-8605-4282-ac70-237747d8b3ef,love it so far wish I could pick words I learned,4,2026-05-18 20:21:30,6.79.5,0,,2026-05-20T03:11:02.643813+00:00
Google Play,com.duolingo,3a90e157-cb09-45c0-8d2e-af0a1e676803,this is good for english language,5,2026-05-18 20:20:33,6.79.5,0,,2026-05-20T03:11:02.643813+00:00
Google Play,com.duolingo,d24927ef-933f-4950-baa7-c9b856eb65e8,hwshsh से विषय पर ध्यान दें कि आप नहीं हैं कि आपके लिए कुछ नहीं देता बच्चों नशेड़ी हैंस है जो आपके पास काम करता हैंस वह आपके पास आ जाता हो तो चलन से ललेता हो जाएगा कि आपके जीवन को रोकने पर कोई भी आओ न तो चालू हो जाएं और आप e से भी अधिक प्रकार से विषय में देने वाला एक अच्छाirjrjeiना होगा जो आप दोनों को रोकने मेंसे हैं कि वे अपनी जगह से विषय को लेकर काफी अच्छा लगे और अपने आप नहीं है और यह भी है कि आपको अपने साथ ले जाएगा और यह आपको किसी भी आओ तो चलन से ललेता हो गए है तो आप नहीं कर सकते और यह आपके प,5,2026-05-18 20:18:22,6.79.5,0,,2026-05-20T03:11:02.643813+00:00
Google Play,com.duolingo,59e7240d-d621-48e0-9eee-b0b1f51a62ca,good 👍,5,2026-05-18 20:17:23,6.79.5,0,,2026-05-20T03:11:02.643813+00:00
Google Play,com.duolingo,f0fe8630-209d-47f7-8508-19eca76d74d2,very helpful 👌,5,2026-05-18 20:15:50,6.79.5,0,,2026-05-20T03:11:02.643813+00:00
Google Play,com.duolingo,afe39412-6203-4624-b25d-bfcd7d97f78c,"It seems to be working. I wished I spent a lot of time with it, though. I think I can learn a full language if I actually finished a course.",5,2026-05-18 20:15:05,3.106.5,0,,2026-05-20T03:11:02.643813+00:00
