source_platform,app_name,app_id,country,language,review_id,review_text,rating,review_date,app_version,thumbs_up_count,developer_response,collected_at
Google Play,Spotify,com.spotify.music,us,en,b269766c-57db-490b-98ab-6ec60a0cd409,premium for every thing .,1,2026-05-18 23:37:00,9.1.44.2120,0,,2026-05-20T03:42:15.807927+00:00
Google Play,Spotify,com.spotify.music,us,en,f3b8295a-84ed-49bf-82fb-d8b4553e49cf,Best experience so far! I use it every day.,5,2026-05-18 23:34:56,9.1.44.2120,0,,2026-05-20T03:42:15.807927+00:00
Google Play,Spotify,com.spotify.music,us,en,3b72d645-aa0a-4802-9788-6f66a5accdd0,music is Life,5,2026-05-18 23:34:40,9.1.44.2120,0,,2026-05-20T03:42:15.807927+00:00
Google Play,Spotify,com.spotify.music,us,en,3cad3261-c745-4388-aab9-fc051a692543,"Ad's, lots of ad's, even in paid for version. completely inappropriate to have ad's in a paid app.",1,2026-05-18 23:34:04,9.1.44.2120,0,,2026-05-20T03:42:15.807927+00:00
Google Play,Spotify,com.spotify.music,us,en,0b97836f-78e8-44dd-8166-bf12e89d03e5,my Spotify is not opening...I have interest in my phone but still it's not opening....please fix it,1,2026-05-18 23:32:59,9.1.44.2120,0,"Hey there, we’d love to get some more info about this. We’d recommend getting in touch with our Customer Service by heading to http://support.spotify.com and searching ""Contact us"". They'll be able to check this for you.",2026-05-20T03:42:15.807927+00:00
Google Play,Spotify,com.spotify.music,us,en,828fc11d-2756-4cc8-b2c1-d9b5f2266b04,"has a wide variety of songs but I swear there is a ad after almost every song, and there's like three of them if just one wasn't annoying enough.other than that it's pretty good. You either love it, question it, or hate it.",3,2026-05-18 23:31:41,9.1.44.2120,0,,2026-05-20T03:42:15.807927+00:00
Google Play,Spotify,com.spotify.music,us,en,63ecdd3d-99ee-44fa-a19a-95feafd4b0b9,this is the best app for songs I love this app👍👍♥️♥️,5,2026-05-18 23:29:53,,0,,2026-05-20T03:42:15.807927+00:00
Google Play,Spotify,com.spotify.music,us,en,70c97bd0-2f4c-447c-bae7-13767590b9e3,it is very useful app for music lovers,4,2026-05-18 23:29:23,9.1.44.2120,0,,2026-05-20T03:42:15.807927+00:00
Google Play,Spotify,com.spotify.music,us,en,ad47781b-b3fd-49cb-a578-4da042a27d64,good entertainment,5,2026-05-18 23:22:38,,0,,2026-05-20T03:42:15.807927+00:00
Google Play,Spotify,com.spotify.music,us,en,c4995456-ba0a-4ce4-a756-3b58000628eb,"Genuinely the most unreliable, buggy, vibe-coded POS app. Will work fine for weeks and months on end and then one day just randomly decide ""no music for you (LOL, LMAO)"" AND DECIDE THAT I HAVE NO INTERNET ON A GIGABIT INTERNET CONNECTION. This happens ACROSS DEVICES, SIMULTANEOUSLY. It doesnt MATTER what I do nothing FIXES it until it just equally randomly decides that everything is fine again after an indeterminate amount of time. This is an UNACCEPTABLE user experience for a PAID service.",2,2026-05-18 23:21:27,9.1.44.2120,0,,2026-05-20T03:42:15.807927+00:00
Google Play,Spotify,com.spotify.music,us,en,e03a8506-f5e0-45a3-af4f-f63a3584aa5a,staying with the integration trend. dope,5,2026-05-18 23:20:54,9.1.44.2120,0,,2026-05-20T03:42:15.807927+00:00
Google Play,Spotify,com.spotify.music,us,en,6a598cfc-6495-4656-910f-d5634e64802b,worst app do not work,1,2026-05-18 23:19:35,9.1.44.2120,0,,2026-05-20T03:42:15.807927+00:00
Google Play,Spotify,com.spotify.music,us,en,551193c8-954a-4109-88c0-382438e199a8,"amazing since they fixed a glitch that made me not able to coose a profile photo, however, I have experienced times where it simply says I have internet problems, I dont, and yet it won't load something properly, but luckily, it seems most of the time its fixed by restarting my phone, as well as time to time it just stops happening,",3,2026-05-18 23:18:01,9.1.44.2120,1,,2026-05-20T03:42:15.807927+00:00
Google Play,Spotify,com.spotify.music,us,en,66e7b1ba-60da-46c8-80f2-740f70afcb72,not work 🤬🤬🤬,1,2026-05-18 23:16:41,9.1.44.2120,0,,2026-05-20T03:42:15.807927+00:00
Google Play,Spotify,com.spotify.music,us,en,e6b36b5d-5c93-47e1-9f67-5f2a00fc67e2,"Opening the first time always assumes that I am on offline mode even when I have wifi or data. I have to open it AGAIN just to get the internet features on this app like streaming, searching, playlists. Not worth it anymore tbh",1,2026-05-18 23:16:23,9.1.44.2120,0,,2026-05-20T03:42:15.807927+00:00
Google Play,Spotify,com.spotify.music,us,en,23f90f48-6f67-45c6-8749-55f660e72505,"---------You can NOT listen to offline downloads unless you're in airplane mode (absolutely dumb) ----------You can't easily edit your ""Liked Songs"" Playlist, you have to remove every song one by one and god forbid you want to remove them all and over over 3k songs in it.‐---------- I hate Spotify for these two things. I've messaged their support team multiple times over the past 5 years and they have done NOTHING to fix these issues.",1,2026-05-18 23:15:30,9.1.44.2120,2,,2026-05-20T03:42:15.807927+00:00
Google Play,Spotify,com.spotify.music,us,en,216ecb3e-5ce5-44c9-a947-df8d140c581b,"I'm sorry but this is suck SUCK. I can't opened the app normally like usual and it says that the connection isn't available while my connection is perfectly good???? hello?? I can only play the downloaded songs cause it says that I'm offline, but actually I'm not since my connection is good and nothing wrong with it. fix it or I'll stop premium-ing.",1,2026-05-18 23:15:03,9.0.96.826,0,,2026-05-20T03:42:15.807927+00:00
Google Play,Spotify,com.spotify.music,us,en,fbf06343-8829-4de8-903f-696f66e5caee,"I have been using the premium version for years, I am fine with price increase but come on the services recently became unbearable: the app constantly shows me ""offline message"" despite me having strong WiFi and mobile Internet, the search function does not work, the app freezes often. I tried log out/ log in, doesn't work. I tried to uninstall the app, then installed back and now it does not open at all - it says ""something is wrong with connection"". Like really? Fix your tech please",1,2026-05-18 23:14:41,9.1.44.2120,0,,2026-05-20T03:42:15.807927+00:00
Google Play,Spotify,com.spotify.music,us,en,a14a7f92-ef89-45ab-b442-98a12b9bdcf5,terrible,1,2026-05-18 23:14:38,9.1.44.2120,0,,2026-05-20T03:42:15.807927+00:00
Google Play,Spotify,com.spotify.music,us,en,59be02dc-d3c1-4888-b847-6e098deae64a,the app is amazing but the Ai dj could be better by having a button to use outside the app,4,2026-05-18 23:14:28,9.1.44.2120,0,,2026-05-20T03:42:15.807927+00:00
Google Play,Spotify,com.spotify.music,us,en,30fc496c-d36e-48b7-ab66-02b7aa0deda8,The app just stopped working for no reason. It will not let you play any of your songs that you WANT. It will delete every single song that you have saved and you have to start all over again.,1,2026-05-18 23:12:09,9.1.48.1661,0,,2026-05-20T03:42:15.807927+00:00
Google Play,Spotify,com.spotify.music,us,en,a186e95d-5be9-430f-991c-b4b7359665fd,"FULL AI / ""VIBE CODING"" aka PROMPT SLOT MACHINE product. when did offline mode get fully iced and every single miniscule function tied to use of wifi/data? I can't cue anything downloaded on my phone or get anything besides a grey screen without one turned on. Even when data is on; response time is painful. founder wanted 300ms; we're at like 3-5 seconds, and glitchy when it is running now they try to trick users into doing AI to themselves? NO THANKS!! Spotify has become decroded and 5h1tty",1,2026-05-18 23:12:01,9.1.44.2120,0,,2026-05-20T03:42:15.807927+00:00
Google Play,Spotify,com.spotify.music,us,en,ac2cb97a-e53e-495d-9010-52d920464bb6,majority the time I can't even load the app but every other app works on my phone I swear the app gets worse and worse every month not even worth the subscription at this point,2,2026-05-18 23:11:13,,0,,2026-05-20T03:42:15.807927+00:00
Google Play,Spotify,com.spotify.music,us,en,3d6901a1-7083-4373-adfa-3fd5e81c5947,"this app is awful. if I didnt already have over 2,000 songs on my playlist id switch over to a different app. the shuffling algorithm is terrible and only shuffles the same handful of songs and thats if the app even works. I have more issues loading podcasts and playlists on spotify then I do every other app.",1,2026-05-18 23:11:05,9.1.44.2120,0,,2026-05-20T03:42:15.807927+00:00
Google Play,Spotify,com.spotify.music,us,en,83d43745-efee-4d1a-8278-85bead4bcdda,fix app please broken not letting me sign in and not letting me do anything,1,2026-05-18 23:11:00,,0,,2026-05-20T03:42:15.807927+00:00
Google Play,Spotify,com.spotify.music,us,en,60252ff8-311b-4962-b454-6b65c796124c,Just tone down the ads there doing nothing for nobody.,2,2026-05-18 23:10:37,9.1.44.2120,0,,2026-05-20T03:42:15.807927+00:00
Google Play,Spotify,com.spotify.music,us,en,16b041b4-13c5-4081-b08c-a39b56de467d,The one music app that constantly gets worse. Always has buggy releases with app constantly crashing or not playing. Just sucks.,1,2026-05-18 23:10:27,9.1.44.2120,1,"Hey there! Sorry to hear that. Have you tried a quick reinstall? If that doesn't help, we'd recommend reaching out to our Customer Service at http://support.spotify.com. Just search “Contact Us”, and they'll be happy to help.",2026-05-20T03:42:15.807927+00:00
Google Play,Spotify,com.spotify.music,us,en,0ca10445-637b-41d0-a244-364785e7e323,"I’ve been using the paid version for 5 years, and I’ve been experiencing issues with the app over the past few months. The app feels unstable, and I’m experiencing more lag than before. We have a stable Wi-Fi connection, and my other apps are working well without any lag. I’m considering canceling my subscription soon and switching to YouTube Music since I’ve already had YouTube Premium for 2 years.",1,2026-05-18 23:10:19,9.1.44.2120,0,,2026-05-20T03:42:15.807927+00:00
Google Play,Spotify,com.spotify.music,us,en,0e9ce4e2-ac63-4a84-905f-6b9151c7eb1c,good,5,2026-05-18 23:10:09,9.1.44.2120,0,,2026-05-20T03:42:15.807927+00:00
Google Play,Spotify,com.spotify.music,us,en,29547889-9ef1-4119-ac94-4a23871c8e3a,algorithm is cooked. shuffle? oh you mean the same shuffle list as last week where every song is in the same shuffle order? no worries. smart shuffle? oh you mean the exact same smart shuffle with the same new songs and song order as many days ago? it's only getting worse and worse.,1,2026-05-18 23:09:58,9.1.44.2120,0,,2026-05-20T03:42:15.807927+00:00
Google Play,Spotify,com.spotify.music,us,en,271e9b22-ca10-4237-b38a-f611e520c367,"Despite paying for premium for years, the app picks and chooses when it wants to work. Half the time it claims to be offline even when my connection is perfect. It sometimes takes hours to get back online. It's incredibly inconvenient and concerning",2,2026-05-18 23:09:55,9.1.44.2120,0,,2026-05-20T03:42:15.807927+00:00
Google Play,Spotify,com.spotify.music,us,en,18d1ee5b-ea2a-4c0e-a768-40355f620cf6,"keep saying im offline, so im unable to play any music. so I go elsewhere to listen music. troublesome app. so many bugs.",2,2026-05-18 23:09:49,9.0.90.1229,0,,2026-05-20T03:42:15.807927+00:00
Google Play,Spotify,com.spotify.music,us,en,ab5cb841-86da-44df-8a20-4045d80f8bc7,Can't open.,1,2026-05-18 23:09:45,8.8.90.893,0,,2026-05-20T03:42:15.807927+00:00
Google Play,Spotify,com.spotify.music,us,en,fbe3ff5d-4812-4f32-acbe-b3f1b6ddcf22,"It's great and all, but can you change the color of the Spotify widget and the amount of ads increased.",4,2026-05-18 23:09:32,,0,,2026-05-20T03:42:15.807927+00:00
Google Play,Spotify,com.spotify.music,us,en,ac549980-fae3-4bde-9231-e6ac4dc3937b,"New Update Sucks, Make it like it was few months ago",4,2026-05-18 23:09:32,9.1.44.2120,2,,2026-05-20T03:42:15.807927+00:00
Google Play,Spotify,com.spotify.music,us,en,abcfd9eb-1eb5-4132-a562-660a866825d8,"Been using Spotify for years, generally happy with it. until today, it's been unable to search and pull up playlist suggestions. I couldn't pull up my own playlists. can't even search keywords like ""piano"" or ""classical"". I uninstalled and reinstalled, which only made it worse. now the app won't even load, I get a ""check your connection"" we have high speed Internet which usually loads lightening quick and I am connected with full bars so I know it's not my connection as that hasn't changed.",2,2026-05-18 23:09:12,,0,,2026-05-20T03:42:15.807927+00:00
Google Play,Spotify,com.spotify.music,us,en,dc3b153f-47cc-4768-8be0-55013422a35d,"Terrible app. Gets laggy overtime, to the point where sometimes it won't even open. basic features never work, 2hile shuffle is terrible and repeats songs in playlists with over 5k songs on them.",1,2026-05-18 23:09:08,9.1.44.2120,0,,2026-05-20T03:42:15.807927+00:00
Google Play,Spotify,com.spotify.music,us,en,ee956baa-f3ee-4750-ad0b-238457ccd7b8,poor service Spotify app,1,2026-05-18 23:09:04,9.1.44.2120,0,,2026-05-20T03:42:15.807927+00:00
Google Play,Spotify,com.spotify.music,us,en,843e1a0c-7a20-45d9-a937-7ff5e8f14d64,doesn't connect to alexa half the time,3,2026-05-18 23:08:56,9.1.6.1145,0,,2026-05-20T03:42:15.807927+00:00
Google Play,Spotify,com.spotify.music,us,en,1adeb31e-e1d8-4ede-88b1-2de22dddd396,fix your app,2,2026-05-18 23:08:56,9.1.44.2120,0,,2026-05-20T03:42:15.807927+00:00
Google Play,Spotify,com.spotify.music,us,en,c8e60440-e2d8-4fcc-9822-bce7d185ba95,I love this app yaar because yeh humesha mera mood samjh jata hai khushi gam motivational kuch bhi ho,5,2026-05-18 23:08:54,9.1.44.2120,0,,2026-05-20T03:42:15.807927+00:00
Google Play,Spotify,com.spotify.music,us,en,d636f9a5-9235-4cbb-abde-8f8a33c6554d,app is glitchy and has been for years. nothing is ever done about it. tired of half baked improvements and yet the app doesn't work half the time.,1,2026-05-18 23:08:53,9.1.44.2120,0,,2026-05-20T03:42:15.807927+00:00
Google Play,Spotify,com.spotify.music,us,en,74436335-8f9b-4a94-8d34-2925ecd58922,love the music,5,2026-05-18 23:08:42,9.1.44.2120,0,,2026-05-20T03:42:15.807927+00:00
Google Play,Spotify,com.spotify.music,us,en,f57f5c70-0100-4780-9384-3c1c1e92ed09,trash app,1,2026-05-18 23:08:31,9.0.50.416,0,,2026-05-20T03:42:15.807927+00:00
Google Play,Spotify,com.spotify.music,us,en,36fddaa1-6565-4830-9761-4307b60b2d12,"I downloaded this app and use some times It is very nice to listen to such songs, but the ads cause a lot of trouble.",4,2026-05-18 23:08:26,9.1.42.2058,0,,2026-05-20T03:42:15.807927+00:00
Google Play,Spotify,com.spotify.music,us,en,a9ec924a-f0be-40a3-8350-6d0b008fde7d,The apps functionality gets worse every update and they have the nerve to increase the price and flood the app with ai slop. I do not recommend this app for audiophile at all. this sucks so bad. The app worked better a decade ago🫩,2,2026-05-18 23:08:25,9.1.34.2060,0,,2026-05-20T03:42:15.807927+00:00
Google Play,Spotify,com.spotify.music,us,en,6d1c0963-288e-458a-85f3-232ca29d3320,"always shows no connection, though I have good internet connection",1,2026-05-18 23:08:06,,0,,2026-05-20T03:42:15.807927+00:00
Google Play,Spotify,com.spotify.music,us,en,582bb5ec-c9d9-4a1b-ae42-7b30bd67141a,it's not working properly,1,2026-05-18 23:08:04,9.1.44.2120,0,,2026-05-20T03:42:15.807927+00:00
Google Play,Spotify,com.spotify.music,us,en,d2c712d4-e938-4994-9295-c2c2ffeed005,My net is fine but this application keeps telling me that I'm offline and also glitching.,1,2026-05-18 23:08:04,9.1.44.2120,0,,2026-05-20T03:42:15.807927+00:00
Google Play,Spotify,com.spotify.music,us,en,8b47e3b6-a68f-4a4f-b9a7-4d9c664c823e,useless app,1,2026-05-18 23:07:45,,0,,2026-05-20T03:42:15.807927+00:00
Google Play,Spotify,com.spotify.music,us,en,35c332fb-d539-4a92-9868-536b8d4201f0,never works always says offline. this app sucks,1,2026-05-18 23:07:34,9.1.44.2120,0,,2026-05-20T03:42:15.807927+00:00
Google Play,Spotify,com.spotify.music,us,en,8fea8765-b3f6-4702-aa41-a860df4a9d03,"2026: random issues with going offline for no reason, and once not letting me use the queue feature. The update in 2023-11 makes it even more difficult. No idea why they changed the ""heart"" functionality to like and unlike songs. Confusing UI. The menus got changed at one point and that's made it worse. It was easier to use earlier. That said, it's a good app.",2,2026-05-18 23:07:31,9.1.44.2120,0,,2026-05-20T03:42:15.807927+00:00
Google Play,Spotify,com.spotify.music,us,en,4074e180-9370-4b1d-8ed6-ea720fcaf334,this is not even good to me like bro cannot even p open,1,2026-05-18 23:07:25,9.1.44.2120,0,,2026-05-20T03:42:15.807927+00:00
Google Play,Spotify,com.spotify.music,us,en,c47a6df7-3646-42f9-912c-946cd78adde6,App is constantly offline when everywhere app works. cant play from liked songs. cant turn off music videos.,1,2026-05-18 23:07:11,9.1.44.2120,0,,2026-05-20T03:42:15.807927+00:00
Google Play,Spotify,com.spotify.music,us,en,48dd9411-720a-4a5b-8c56-98308b770b6e,for me it will work for a while and then stop loading so I have to Uninstall and install it again every other week,2,2026-05-18 23:07:01,9.1.44.2120,0,,2026-05-20T03:42:15.807927+00:00
Google Play,Spotify,com.spotify.music,us,en,81d715a3-08f4-4e90-8452-c83507bc26f6,"Takes about 5 minutes to go from offline to online especially after force closing and clearing cache on S25 Ultra (family plan - main account holder, wifi and at&t 5G, turned on/off airplane mode didn't fix).",1,2026-05-18 23:06:41,9.1.48.1656,0,,2026-05-20T03:42:15.807927+00:00
Google Play,Spotify,com.spotify.music,us,en,e30c79cd-0376-4306-b37f-04f44bd7a86d,"""Discover weekly"" was all a single genre with artists I already had saved. The ""on repeat"" playlist is made obsolete by a comically bad shuffle. There really should be an ""off repeat"" playlist so that I do not end up only listening to my most recent songs. It's also an AI music app with no way to differentiate between AI and real artists. Sometimes, real artist names will be used for the AI music, which seems legally dubious. Loads sometimes. Doesn't load other times. App is jank now.",2,2026-05-18 23:06:27,9.1.48.1656,25,,2026-05-20T03:42:15.807927+00:00
Google Play,Spotify,com.spotify.music,us,en,53946348-89c4-4309-bd57-58293bb8b7eb,"trash app, always loading, youtube number 1",1,2026-05-18 23:06:21,9.1.44.2120,0,,2026-05-20T03:42:15.807927+00:00
Google Play,Spotify,com.spotify.music,us,en,ce6a5ed7-c3f6-46a2-8eae-9bb568128390,i listen to this to sleep and recently the app won't function and it blames it on my Internet connection?? luckily for me I have YouTube premium and my favorite creator post their podcasts on both platforms. but yike spoofy. I've been a huge fan since 2018 but if this keeps up... I can't do it,2,2026-05-18 23:06:04,9.1.30.1993,0,,2026-05-20T03:42:15.807927+00:00
Google Play,Spotify,com.spotify.music,us,en,8736acdf-828f-4917-afdd-dfa11ff246db,be great if this app worked constantley loading and refreshing please sort it out been going on for weeks now if i could give this half a star i would,1,2026-05-18 23:05:50,9.1.44.2120,0,,2026-05-20T03:42:15.807927+00:00
Google Play,Spotify,com.spotify.music,us,en,90786931-06d1-45f1-ba1f-072d97263701,Constantly glitches and says I am off line when Im online. Always issues with this app honestly please fix it,1,2026-05-18 23:05:48,9.1.48.1656,0,,2026-05-20T03:42:15.807927+00:00
Google Play,Spotify,com.spotify.music,us,en,fdb4a0d6-fe6a-4210-8751-7e2522eddd14,"worst app after ,regret after buying subscription always say something not right even fast internet",1,2026-05-18 23:05:40,9.1.48.1656,0,,2026-05-20T03:42:15.807927+00:00
Google Play,Spotify,com.spotify.music,us,en,fe72ee8d-bf7e-493f-aa33-87fc71f60fcb,doesn't work after connecting to netwerk,1,2026-05-18 23:05:39,9.1.44.2120,0,,2026-05-20T03:42:15.807927+00:00
Google Play,Spotify,com.spotify.music,us,en,0c8d6009-c445-4110-957c-275675827705,Music is my stress release it is daily in my genetic make up,4,2026-05-18 23:05:37,9.1.44.2120,0,,2026-05-20T03:42:15.807927+00:00
Google Play,Spotify,com.spotify.music,us,en,0db2c69c-d93b-4796-9efb-438aeace12f1,"when we use the app , some time it stops working and shows offline if we are in full range of network it says you are offline and after adding premium lite there is no downloading option which is not a good thing (disappointed)",1,2026-05-18 23:04:52,9.1.44.2120,0,,2026-05-20T03:42:15.807927+00:00
Google Play,Spotify,com.spotify.music,us,en,f1eb4bb1-d4a6-4efe-ae4e-05facad91e91,"too many ads, giving us 4-5 ads every 10 minutes this app used to be enjoyable now all it's about is ads and premium",3,2026-05-18 23:04:48,9.1.44.2120,0,,2026-05-20T03:42:15.807927+00:00
Google Play,Spotify,com.spotify.music,us,en,2f797f55-d5e4-42f4-b162-841cab0797ae,wasted,1,2026-05-18 23:04:00,9.1.44.2120,0,,2026-05-20T03:42:15.807927+00:00
Google Play,Spotify,com.spotify.music,us,en,653e8c51-fe01-4ddb-9385-619fbfef85e3,WAY too many ads. there's a glitch they haven't fixed where there's three to four ads in a row then another song then five more. Plus their messages never work correctly + the app shows your offline when you have 5g WiFi and mobile data 🫩 One of the worst music apps for how popular it is,2,2026-05-18 23:03:05,9.1.44.2120,0,,2026-05-20T03:42:15.807927+00:00
Google Play,Spotify,com.spotify.music,us,en,05f7bc4b-4e21-46f0-bf17-a03e4ccfd71c,"Can't use the app. Always says, ""Something went wrong."" My phone is Techno Camon 30.",1,2026-05-18 23:03:03,9.1.48.1661,0,,2026-05-20T03:42:15.807927+00:00
Google Play,Spotify,com.spotify.music,us,en,f6a1dbcf-eb25-4309-b780-08c29f15537c,I am honestly sick and tired of Spotify not fixing any bugs that the app clearly has I have issues no matter the phone even my ps5.,1,2026-05-18 23:02:36,9.1.44.2120,0,,2026-05-20T03:42:15.807927+00:00
Google Play,Spotify,com.spotify.music,us,en,5e6dedc9-ac8f-4956-b6b0-d7bca37c5330,"I wish this app wasn't total trash a lot of the time. Literally shouldn't ever be, since I (and millions of others) pay for their service, but still is, often. Screw us though. We continue to pay, who cares.",2,2026-05-18 23:02:19,9.1.44.2120,0,,2026-05-20T03:42:15.807927+00:00
Google Play,Spotify,com.spotify.music,us,en,f989b945-d2b8-4819-8380-c7b0cc4096a7,"they run ads for ICE. I plan to unsubscribe because of this. Also, their support cited absolutely non-existent. It does not load in Firefox or Chrome. Check out tidal.",1,2026-05-18 23:02:09,9.1.48.1656,7,,2026-05-20T03:42:15.807927+00:00
Google Play,Spotify,com.spotify.music,us,en,2c85a11c-0e13-49d8-8e62-5f40f1d34c0e,"whenever I open sometimes it says im offline but I'm not, how to fix this?",4,2026-05-18 23:02:06,9.1.44.2120,0,,2026-05-20T03:42:15.807927+00:00
Google Play,Spotify,com.spotify.music,us,en,8095591d-0889-489f-ab6a-23eb3a7ad37f,"Too many ads, stops working randomly, and won't load my songs anymore or let me log back in",3,2026-05-18 23:01:32,,0,,2026-05-20T03:42:15.807927+00:00
Google Play,Spotify,com.spotify.music,us,en,7ab40611-a341-4dfc-a51d-3651349f854d,too much bugs and ads,1,2026-05-18 23:01:23,,0,,2026-05-20T03:42:15.807927+00:00
Google Play,Spotify,com.spotify.music,us,en,fc3ab132-b2c3-4310-bb8f-bde511d65764,it takes SO LONG to load. it's not even working on some cases. Please fix this.,3,2026-05-18 23:01:21,9.1.24.1739,0,,2026-05-20T03:42:15.807927+00:00
Google Play,Spotify,com.spotify.music,us,en,ded6d53a-2c1c-4726-ac9c-8c3219eaa80e,"I like Spotify and I've used it for awhile. However, lately I've had a problem with how it detects me being offline despite it hardly ever being true.",3,2026-05-18 23:01:01,9.1.44.2120,1,,2026-05-20T03:42:15.807927+00:00
Google Play,Spotify,com.spotify.music,us,en,fc1b778c-c0e2-47c4-a72d-21ab64be219a,"On Premium version, it'll say there's an issue with searching for new music, even when other apps that use more internet are working fine - definitely seems to be an issue with this app",3,2026-05-18 23:00:41,,0,,2026-05-20T03:42:15.807927+00:00
Google Play,Spotify,com.spotify.music,us,en,c2179ebf-0a8e-41da-aafc-b8fe4160ccb0,"there should be some type of legal accountability for companies that have an app that has a paid version, but REFUSE to fix the app that they KNOW is broken! its slow! its buggy! and no none of the ""troubleshooting"" works BECAUSE ITS THE APP ITSELF! And they know this. and why all the new features? let youtube be youtube ! wish I could give zero starz. took a great app and ruined it.",1,2026-05-18 23:00:35,9.1.44.2120,1,,2026-05-20T03:42:15.807927+00:00
Google Play,Spotify,com.spotify.music,us,en,2a065d3d-57e2-4c0c-9b17-e347ae14fd45,Simply DOES NOT WORK ANYMORE. Try it and I guarantee you will run into problems. Radio is starting to look really good.,1,2026-05-18 23:00:22,,0,,2026-05-20T03:42:15.807927+00:00
Google Play,Spotify,com.spotify.music,us,en,58bd94af-138e-47ef-adc3-68e6ec5d079e,"Y'all really wanted the premium users only, cuz wdym I gotta play 1 to 2 ads just to play one song. And the fact that it has limit too, Y'all gotta be joking. It's good but y'all are so hungry for premium users.",1,2026-05-18 22:59:56,9.1.44.2120,0,,2026-05-20T03:42:15.807927+00:00
Google Play,Spotify,com.spotify.music,us,en,71c04ef2-c1bf-48a5-b28d-4968a5338b52,what up with this app I try to login on my new phone and it acts like I have no wifi or signal this is frustrating,1,2026-05-18 22:59:46,9.1.48.1656,0,,2026-05-20T03:42:15.807927+00:00
Google Play,Spotify,com.spotify.music,us,en,eae5f920-9f68-4a7b-ae13-d20480eb3069,paying for subscription but this app says im offline even tho im online. will uninstall after subscription,1,2026-05-18 22:59:12,9.1.44.2120,0,,2026-05-20T03:42:15.807927+00:00
Google Play,Spotify,com.spotify.music,us,en,6a0f2a23-4935-4403-8bae-ec857a1e6454,nice aap 😄,5,2026-05-18 22:59:09,,0,,2026-05-20T03:42:15.807927+00:00
Google Play,Spotify,com.spotify.music,us,en,a6129cc8-ddcb-4455-a474-75bdf8a5ad34,worst app ever,1,2026-05-18 22:58:47,,0,,2026-05-20T03:42:15.807927+00:00
