source_platform,app_name,app_id,country,language,review_id,review_text,rating,review_date,app_version,thumbs_up_count,developer_response,collected_at
Google Play,Spotify,com.spotify.music,us,en,ed52143c-c813-45bf-9e74-a259eb2f98a0,The most useless music app,1,2026-05-17 09:31:41,9.1.0.1147,0,,2026-05-20T03:42:15.807927+00:00
Google Play,Spotify,com.spotify.music,us,en,f1bde897-7245-4ef0-a63e-bf4e0fbc563b,best app while working,5,2026-05-17 09:30:43,9.1.42.2058,0,,2026-05-20T03:42:15.807927+00:00
Google Play,Spotify,com.spotify.music,us,en,cdbcd8c3-41d8-4fd5-af61-b9d8e37bc18a,Toyrt wvojo.,3,2026-05-17 09:27:41,9.1.16.1450,0,,2026-05-20T03:42:15.807927+00:00
Google Play,Spotify,com.spotify.music,us,en,f5fa2c12-b538-4e7f-a6b9-38f86c53097c,Ad free,5,2026-05-17 09:25:36,9.1.44.2120,0,,2026-05-20T03:42:15.807927+00:00
Google Play,Spotify,com.spotify.music,us,en,4659b844-3363-42f4-8f4f-7da0a8059c24,bad experience why are you doing limited access,1,2026-05-17 09:24:06,,0,,2026-05-20T03:42:15.807927+00:00
Google Play,Spotify,com.spotify.music,us,en,5ca58a96-99b6-4238-a898-9e8ccd973e43,The best thing ever for music is this!,5,2026-05-17 09:23:43,9.1.44.2120,0,,2026-05-20T03:42:15.807927+00:00
Google Play,Spotify,com.spotify.music,us,en,e6625a9b-d3ce-4d2f-9256-d3debc553dac,it is so good ....,5,2026-05-17 09:23:06,,0,,2026-05-20T03:42:15.807927+00:00
Google Play,Spotify,com.spotify.music,us,en,15458f21-1b29-41d6-bdb1-7ebfcbc06798,the best,5,2026-05-17 09:21:33,9.1.42.2058,0,,2026-05-20T03:42:15.807927+00:00
Google Play,Spotify,com.spotify.music,us,en,6d434cdd-b84e-43c2-8646-ab1f9ead53a6,I really love Spotify,5,2026-05-17 09:19:52,9.1.44.2120,0,,2026-05-20T03:42:15.807927+00:00
Google Play,Spotify,com.spotify.music,us,en,b28031c7-abf5-4c99-a135-175d45fe398c,greedy,1,2026-05-17 09:16:50,9.0.76.1126,0,,2026-05-20T03:42:15.807927+00:00
Google Play,Spotify,com.spotify.music,us,en,691b6d62-5917-4d3a-82d6-cd56dee5888b,📱👍,5,2026-05-17 09:16:24,,0,,2026-05-20T03:42:15.807927+00:00
Google Play,Spotify,com.spotify.music,us,en,c07dde96-03d0-4261-aa53-6264b19dbdd3,i love your promotion,5,2026-05-17 09:15:41,9.1.44.2120,0,,2026-05-20T03:42:15.807927+00:00
Google Play,Spotify,com.spotify.music,us,en,262aa9f3-4a84-48cc-8469-39da083afe4b,one of the best music listening app,5,2026-05-17 09:15:37,9.1.44.2120,0,,2026-05-20T03:42:15.807927+00:00
Google Play,Spotify,com.spotify.music,us,en,3258e0dc-a237-4312-a0bc-ecf77afa8752,everything 3r,4,2026-05-17 09:13:37,9.1.44.2120,0,,2026-05-20T03:42:15.807927+00:00
Google Play,Spotify,com.spotify.music,us,en,dc4415da-d611-4b9a-9875-090303730e21,"The free version has started to become a headache and is even becoming terrible to be brutally honest. After every 2 songs, there are 3 long ads, then there is the constant persuasion to get premium. We can't play songs in our desired order, can't skip more than 6 times per hour, can't choose to play any song. Please do something about this, and remove some of the restrictions users are facing in the free version.",1,2026-05-17 09:11:35,9.1.44.2120,1,,2026-05-20T03:42:15.807927+00:00
Google Play,Spotify,com.spotify.music,us,en,f1c2c041-e653-45ba-ad84-541ff059cf6e,"Nice but has two defects: 1. Severe long ads (Which can't be skipped 2. Only playlists, There are no variety of songs seen",3,2026-05-17 09:11:23,,0,,2026-05-20T03:42:15.807927+00:00
Google Play,Spotify,com.spotify.music,us,en,66b10034-5c06-453b-988e-776eb9f3c0ee,i love this apppppp love yall spotify,5,2026-05-17 09:05:30,9.1.44.2120,0,,2026-05-20T03:42:15.807927+00:00
Google Play,Spotify,com.spotify.music,us,en,fc0a7acf-9860-4895-8ad9-495f089efed7,spotify is great been there for 10 years since november 26 2016... now it needs lossless audio to compete with apple music... i do notice the difference!,4,2026-05-17 09:04:05,,0,,2026-05-20T03:42:15.807927+00:00
Google Play,Spotify,com.spotify.music,us,en,2783cf7d-f763-4362-a3a8-4a9726b720ca,"Selalu pakai Spotify setiap kegiatan, tapi aku kurang suka nya iklan makin banyak, terus liat lirik juga harus premium. Tolong dong Spotify liriknya jgn di premium hehe",4,2026-05-17 09:02:34,9.1.44.2120,0,,2026-05-20T03:42:15.807927+00:00
Google Play,Spotify,com.spotify.music,us,en,cf3836d4-fe1d-405b-bc56-75f5fd72f1d1,worst experience,1,2026-05-17 09:01:34,9.1.42.2058,0,,2026-05-20T03:42:15.807927+00:00
Google Play,Spotify,com.spotify.music,us,en,ba63df9a-3528-4856-bbac-f23bb3d9415d,i like the app but I want all lyrics,5,2026-05-17 09:00:07,9.1.42.2058,0,,2026-05-20T03:42:15.807927+00:00
Google Play,Spotify,com.spotify.music,us,en,96d02e79-7971-481f-95d8-19d5f14b8b1f,"Exhaustive library. Excellent recordings. Appreciate ease of forming personal lists. Would use more often if ads were visual not auditory. Though they are meant to capture attention, marketing has become noise. Creators need to find another approach besides interruptions.",5,2026-05-17 08:58:13,9.1.44.2120,0,,2026-05-20T03:42:15.807927+00:00
Google Play,Spotify,com.spotify.music,us,en,8fcf7b97-47a5-42ec-8063-0fede21e2594,super happy with the songs,5,2026-05-17 08:57:47,9.1.44.2120,0,,2026-05-20T03:42:15.807927+00:00
Google Play,Spotify,com.spotify.music,us,en,0a30d52c-7dcb-472b-bf55-469efa6b25ad,¡¡¡ Spotify Keeps Me Alive... Literally!!! ¡¡¡ Without Music I Would Be Uncontrollably Unstable !!!,5,2026-05-17 08:52:22,9.1.44.2120,0,,2026-05-20T03:42:15.807927+00:00
Google Play,Spotify,com.spotify.music,us,en,125ed817-dbb7-42e9-a89d-f655f5f21a56,very good,5,2026-05-17 08:52:03,9.1.44.2120,0,,2026-05-20T03:42:15.807927+00:00
Google Play,Spotify,com.spotify.music,us,en,9a07063d-05af-4a84-99a3-c25bfadd84a9,i hate these new features which require me to buy premium judt to take those stupid features away,1,2026-05-17 08:51:59,9.0.58.596,0,,2026-05-20T03:42:15.807927+00:00
Google Play,Spotify,com.spotify.music,us,en,27c962b6-feee-4750-84c4-a4e5df3828c9,I love the app♥️,5,2026-05-17 08:51:56,9.1.44.2120,0,,2026-05-20T03:42:15.807927+00:00
Google Play,Spotify,com.spotify.music,us,en,79d13e6b-ec3b-4f7c-927d-428adc57f2ed,I love music XD,5,2026-05-17 08:50:26,9.1.44.2120,0,,2026-05-20T03:42:15.807927+00:00
Google Play,Spotify,com.spotify.music,us,en,943aba13-7791-4178-a0d5-53417329c28e,"Recent update, make the Apps laggy",2,2026-05-17 08:48:23,,0,,2026-05-20T03:42:15.807927+00:00
Google Play,Spotify,com.spotify.music,us,en,ea408641-19d0-448a-9964-d44c07c648ff,no question,5,2026-05-17 08:46:40,9.1.44.2120,0,,2026-05-20T03:42:15.807927+00:00
Google Play,Spotify,com.spotify.music,us,en,846cdd82-eaf8-4f25-8113-5a10e854828e,Is now pushing a lot of pop ups and ads on the home screen and in playlists without an option to turn it off. Very annoying. Also removing the like button makes no sense. I'm paying you every month why is this not enough? Also now consuming all your battery in the background while not being on.,1,2026-05-17 08:45:14,9.1.42.2058,3,,2026-05-20T03:42:15.807927+00:00
Google Play,Spotify,com.spotify.music,us,en,de0e95b0-3f77-46f1-85c5-26447d1e50d6,Nice,5,2026-05-17 08:42:17,9.1.44.2120,0,,2026-05-20T03:42:15.807927+00:00
Google Play,Spotify,com.spotify.music,us,en,2d86c9c5-1600-4bd2-a9d3-8bd421b6a43b,GREAT APP,5,2026-05-17 08:33:27,9.1.44.2120,0,,2026-05-20T03:42:15.807927+00:00
Google Play,Spotify,com.spotify.music,us,en,76c90c58-9d80-41bc-9b3c-8e3c2948c46f,Too much ad,3,2026-05-17 08:33:22,9.1.44.2120,0,,2026-05-20T03:42:15.807927+00:00
Google Play,Spotify,com.spotify.music,us,en,47ce7454-a673-4b2a-913d-d976e43d44f0,JUST GOOD.,5,2026-05-17 08:32:53,9.1.44.2120,0,,2026-05-20T03:42:15.807927+00:00
Google Play,Spotify,com.spotify.music,us,en,54aa7bdb-bcb0-48ad-9a53-de54157885e4,packed with bugs and glitches. Each update brings an additional bug. Please develop a finished app. Furthermore the ceo is in investing into military drones,1,2026-05-17 08:32:45,9.1.44.2120,4,,2026-05-20T03:42:15.807927+00:00
Google Play,Spotify,com.spotify.music,us,en,c28eb396-2fdc-43a2-bd98-e181f9cdfad9,"Just getting used to this app. Initially downloaded as I came across music on Facebook and it's available on Spotify. So far so good, for music. I mainly use in the car. Free Trial for Premium Access to books. Not sure I want to pay for audiobooks long term, as not used that part much. Although not sure how to cancel Premium Access before the trial period ends and the £12.99 monthly fee starts.",4,2026-05-17 08:31:51,9.1.48.1656,0,,2026-05-20T03:42:15.807927+00:00
Google Play,Spotify,com.spotify.music,us,en,ff20b38d-39e5-41f6-a391-034915c62a96,I have used Spotify for years and it has been great but the ads are torture. 2-3 songs then 2 minutes of ads and every one of them is just telling you to get premium. If you can't afford premium it may be better for you to go to another music app as the ads are insufferable,2,2026-05-17 08:25:14,9.1.44.2120,1,"Hey! We hear you, and we'll pass your feedback along to the Ads team. Also, you might be able to find some steps to help with this on our Community. Just head to community.spotify.com and search for ""30 mins of uninterrupted listening"".",2026-05-20T03:42:15.807927+00:00
Google Play,Spotify,com.spotify.music,us,en,cea3134c-15f8-4204-86f2-76e031287cc8,beat,5,2026-05-17 08:24:29,,0,,2026-05-20T03:42:15.807927+00:00
Google Play,Spotify,com.spotify.music,us,en,6a01fd18-e020-4514-b8d6-40f3fb064242,aplikasi kikir sialan,3,2026-05-17 08:23:46,8.9.92.408,0,,2026-05-20T03:42:15.807927+00:00
Google Play,Spotify,com.spotify.music,us,en,9029525d-8c8f-4bcb-b195-71b6d1900ec2,good,5,2026-05-17 08:22:47,9.1.44.2120,0,,2026-05-20T03:42:15.807927+00:00
Google Play,Spotify,com.spotify.music,us,en,ed877bd8-4662-474e-b988-a9d24a3496d7,love this app,5,2026-05-17 08:21:18,9.1.44.2120,0,,2026-05-20T03:42:15.807927+00:00
Google Play,Spotify,com.spotify.music,us,en,89182f8a-fef8-4a61-a9cd-a930e2bf2d2b,enjoy the whole interface. very interactive,5,2026-05-17 08:20:22,9.1.44.2120,0,,2026-05-20T03:42:15.807927+00:00
Google Play,Spotify,com.spotify.music,us,en,e1d1a49e-1b9a-4e71-a2e3-464d9373817f,this app is amazing 👏,5,2026-05-17 08:18:03,9.1.44.2120,0,,2026-05-20T03:42:15.807927+00:00
Google Play,Spotify,com.spotify.music,us,en,cf018cfb-7e68-4b00-803d-12facb8c5ce3,I love Spotify and have had it for years!,5,2026-05-17 08:18:02,9.1.44.2120,0,,2026-05-20T03:42:15.807927+00:00
Google Play,Spotify,com.spotify.music,us,en,fa9b04e8-3687-420a-b35e-ec914415e344,smooth playing,5,2026-05-17 08:15:38,,0,,2026-05-20T03:42:15.807927+00:00
Google Play,Spotify,com.spotify.music,us,en,04eb97be-1c14-4ab0-9c2f-a2b1f820c5ea,اشوفه احسن تطبيق الاغاني بس الاعلانات مزعجة اذا ما مشترك بريميم,4,2026-05-17 08:14:01,9.1.44.2120,0,,2026-05-20T03:42:15.807927+00:00
Google Play,Spotify,com.spotify.music,us,en,b488d85e-ff42-4a39-9a89-234664321ee1,sorry bro !! but this very Good but again to again buy premium to.play song 1by 1 but do not buy premium again so delete iy,1,2026-05-17 08:13:39,,0,,2026-05-20T03:42:15.807927+00:00
Google Play,Spotify,com.spotify.music,us,en,4faaaf6c-ad5d-43d8-a65b-a10844e3de8b,exp namnnnnnnnnnnnnnnm,5,2026-05-17 08:10:45,9.1.44.2120,0,,2026-05-20T03:42:15.807927+00:00
Google Play,Spotify,com.spotify.music,us,en,726bf98a-86c0-49e6-80a6-af2d1ca794b6,ok,2,2026-05-17 08:09:04,,0,,2026-05-20T03:42:15.807927+00:00
Google Play,Spotify,com.spotify.music,us,en,03d9724f-6ff8-4214-be39-d3bc57b54d3d,Very nice app but my only concern is the too much ads and the subscription,4,2026-05-17 08:08:48,,0,,2026-05-20T03:42:15.807927+00:00
Google Play,Spotify,com.spotify.music,us,en,8eccf2cf-887a-4b8b-b74a-8e22d05b1e05,so many good songs💐😌 but one problem is that Soo many ads and I don't have money to the Spotify premium 😔,4,2026-05-17 08:07:45,9.1.44.2120,0,,2026-05-20T03:42:15.807927+00:00
Google Play,Spotify,com.spotify.music,us,en,d4c3caa7-2469-4b9f-8dea-abdbbc4029fc,It's a good app,5,2026-05-17 08:07:43,,0,,2026-05-20T03:42:15.807927+00:00
Google Play,Spotify,com.spotify.music,us,en,d4925924-a5d8-4079-acf0-01411b51f054,to bad quality,5,2026-05-17 08:04:02,9.1.44.2120,0,,2026-05-20T03:42:15.807927+00:00
Google Play,Spotify,com.spotify.music,us,en,e78872d9-ea85-45ae-99ec-c772d99bdce0,best music player,5,2026-05-17 08:01:56,9.1.44.2120,0,,2026-05-20T03:42:15.807927+00:00
Google Play,Spotify,com.spotify.music,us,en,831b964c-e50c-4271-bfef-6c2a67c2436f,now days with this new update you can't enjoy Spotify without being a premium user they will force you to pay with all the adds and limits to how many songs you can listen to gotta look for another app,1,2026-05-17 08:01:27,9.1.24.1739,0,,2026-05-20T03:42:15.807927+00:00
Google Play,Spotify,com.spotify.music,us,en,837adcc0-3162-435d-b6d6-5fc42436b653,This is good for BTS🥰🥰🥰,5,2026-05-17 07:54:14,9.1.44.2120,0,,2026-05-20T03:42:15.807927+00:00
Google Play,Spotify,com.spotify.music,us,en,97889757-9dc5-4a21-989e-feafb9e62eba,"very very very very very poor aap fir sportify app in tha play music for one by one in option for a primium it,s a very poor aap",2,2026-05-17 07:53:10,9.1.44.2120,0,,2026-05-20T03:42:15.807927+00:00
Google Play,Spotify,com.spotify.music,us,en,999bb8ff-0ffd-4d26-8b1e-e9bc807be29e,The sounds are very clear without distortions. Easy access to every song I want.,5,2026-05-17 07:50:52,9.1.42.2058,0,,2026-05-20T03:42:15.807927+00:00
Google Play,Spotify,com.spotify.music,us,en,268e7087-0b44-4ad6-912a-ec07f2f316ec,no premium subscription only free is best,1,2026-05-17 07:50:00,8.9.90.127,0,,2026-05-20T03:42:15.807927+00:00
Google Play,Spotify,com.spotify.music,us,en,2ec89fff-683e-4ee0-a65e-2a329805d23f,can't do nothing without premium. This app is beyond cooked,1,2026-05-17 07:49:34,9.1.44.2120,0,,2026-05-20T03:42:15.807927+00:00
Google Play,Spotify,com.spotify.music,us,en,2df5a6ce-19c2-4357-b622-fa1656bec5b2,good,5,2026-05-17 07:46:31,,0,,2026-05-20T03:42:15.807927+00:00
Google Play,Spotify,com.spotify.music,us,en,5180cc04-8ede-413e-a2e7-77521dc80211,it's 😃,5,2026-05-17 07:46:16,9.1.44.2120,0,,2026-05-20T03:42:15.807927+00:00
Google Play,Spotify,com.spotify.music,us,en,08d35012-009c-438c-9cf5-1c31967ca56c,bahut achcha game hai,5,2026-05-17 07:46:04,9.1.44.2120,0,,2026-05-20T03:42:15.807927+00:00
Google Play,Spotify,com.spotify.music,us,en,4232df80-7ef9-46f0-aeff-9b351c9c772d,really reliable for music,4,2026-05-17 07:45:24,9.1.44.2120,0,,2026-05-20T03:42:15.807927+00:00
Google Play,Spotify,com.spotify.music,us,en,4d25899f-a79c-479b-b695-5c946bec0184,too good too explain but little expensive,4,2026-05-17 07:43:49,9.1.44.2120,0,,2026-05-20T03:42:15.807927+00:00
Google Play,Spotify,com.spotify.music,us,en,27ada79f-ed34-4fe2-8e3c-7b4e3b741dfb,This doesn't even deserve 1 star.,1,2026-05-17 07:43:06,9.1.44.2120,1,,2026-05-20T03:42:15.807927+00:00
Google Play,Spotify,com.spotify.music,us,en,022df53b-c4ac-4218-b850-08e78c526655,"फालतू हो गया आजकल, हर एक दो गाणे के बाद ढेर सारा विज्ञापन कोणसाभी गाना लगावो दुसरा गाना फालतू क्योकी प्रो लेलो अभी उडा देता हूं ऍप bye e",1,2026-05-17 07:39:26,9.1.44.2120,0,,2026-05-20T03:42:15.807927+00:00
Google Play,Spotify,com.spotify.music,us,en,167213df-0d1f-4887-8230-709a430a7233,"I'm a premium user and now it won't let me renew my subscription, secondly if eel like my account has been compromised because normally when my subscription runs out, it would still let me have access to my account, but now I noticed my account was logged out",1,2026-05-17 07:38:33,,0,,2026-05-20T03:42:15.807927+00:00
Google Play,Spotify,com.spotify.music,us,en,cb961fab-61ef-49d2-9632-29e8a98854b2,"error cuy gasukak. iklannya banyak mengganggu lagu, selalu disuruh prem, malas gua membuang buang duit. dah kikir error pula💔🙄🙄",2,2026-05-17 07:36:52,,0,,2026-05-20T03:42:15.807927+00:00
Google Play,Spotify,com.spotify.music,us,en,5d33251f-3559-4f7a-8944-cb59ccb48a5f,great source of music an podcasts.,5,2026-05-17 07:36:35,9.1.44.2120,0,,2026-05-20T03:42:15.807927+00:00
Google Play,Spotify,com.spotify.music,us,en,d76d5fe1-d9e2-4719-bda1-e7c0872427eb,Super amazing,5,2026-05-17 07:36:12,9.1.44.2120,0,,2026-05-20T03:42:15.807927+00:00
Google Play,Spotify,com.spotify.music,us,en,df50c2c7-933f-4cd5-be7d-a0df5d167281,it's to bad having so many ads and we must put premium for change songs,1,2026-05-17 07:34:08,9.1.44.2120,0,,2026-05-20T03:42:15.807927+00:00
Google Play,Spotify,com.spotify.music,us,en,382a2f00-0198-4186-bec8-99ae4a727c66,exaltation,5,2026-05-17 07:31:39,9.1.44.2120,0,,2026-05-20T03:42:15.807927+00:00
Google Play,Spotify,com.spotify.music,us,en,c7f5ceed-e45f-42c5-9333-9518dcb4ef59,this app is way too annoying. it has limits for listening songs and more over tons of adds.,1,2026-05-17 07:31:01,9.1.44.2120,0,,2026-05-20T03:42:15.807927+00:00
Google Play,Spotify,com.spotify.music,us,en,30b702f4-5ed0-4c38-8945-5582e0545f9d,✅✅✅✅✅✅,5,2026-05-17 07:28:44,9.1.44.2120,0,,2026-05-20T03:42:15.807927+00:00
Google Play,Spotify,com.spotify.music,us,en,7c974267-827e-4b28-b1ae-48373c98201a,good up,5,2026-05-17 07:28:32,9.1.44.2120,0,,2026-05-20T03:42:15.807927+00:00
Google Play,Spotify,com.spotify.music,us,en,e8cc61fb-72d3-4bb0-81de-aca5d1c8be44,I only have this app because of Micheal Jackson 💃🏻💃🏻💃🏻 great app though🌼,5,2026-05-17 07:25:06,9.1.44.2120,0,,2026-05-20T03:42:15.807927+00:00
Google Play,Spotify,com.spotify.music,us,en,2c578107-328d-4659-909a-22b3ceec7db5,premium,5,2026-05-17 07:24:49,9.1.44.2120,0,,2026-05-20T03:42:15.807927+00:00
Google Play,Spotify,com.spotify.music,us,en,8a7ae064-be21-4d11-818e-90e5d83196c1,nice app but without adds nice app in world wow wowowowowowowowo,5,2026-05-17 07:23:26,9.1.44.2120,0,,2026-05-20T03:42:15.807927+00:00
Google Play,Spotify,com.spotify.music,us,en,e5b09ba2-202b-4ab1-b013-d9527c2f983c,I bought premium and it's good yeah but it's expensive,5,2026-05-17 07:22:31,9.1.44.2120,0,,2026-05-20T03:42:15.807927+00:00
Google Play,Spotify,com.spotify.music,us,en,ea0fcdc9-e3c6-4f62-ba21-f4097f053a2b,it is very easy to use,4,2026-05-17 07:21:39,9.1.44.2120,0,,2026-05-20T03:42:15.807927+00:00
Google Play,Spotify,com.spotify.music,us,en,77bd78de-5765-4c8f-8110-709411ad7301,sennere,3,2026-05-17 07:18:42,9.0.94.274,0,,2026-05-20T03:42:15.807927+00:00
Google Play,Spotify,com.spotify.music,us,en,dbc8eb4f-5261-41f6-9742-0039dd4a425a,this is the best app for song and etc bessssst ever ⭐⭐⭐⭐⭐,5,2026-05-17 07:17:58,9.1.42.2058,0,,2026-05-20T03:42:15.807927+00:00
Google Play,Spotify,com.spotify.music,us,en,5fdf5264-5ff5-414b-a931-5bf8cca4752e,cool dude,5,2026-05-17 07:17:49,9.1.44.2120,0,,2026-05-20T03:42:15.807927+00:00
Google Play,Spotify,com.spotify.music,us,en,95fdecba-1d12-49ae-9e16-3898e6c797e1,TOO MANY POP UP ADDS!!!!!,4,2026-05-17 07:16:40,,0,,2026-05-20T03:42:15.807927+00:00
Google Play,Spotify,com.spotify.music,us,en,6afb3232-0c16-4114-bb3c-4caabe30ad67,this app is good but I'm having a problem whenever I tried to play a music and goes to play a game and then in a minute it automatically closed I have to leave my game and play the music and a minute goes by it closed again can y'all explaint this or maybe fix it I'll wait for the respond I will raise this to five star if u responded to me I'm not threatening,1,2026-05-17 07:15:20,9.1.48.1656,0,,2026-05-20T03:42:15.807927+00:00
Google Play,Spotify,com.spotify.music,us,en,11e764a3-0279-4516-b672-c5a561e62c98,this app is so best so awesome 👍😎 I really like Spotify playlist,5,2026-05-17 07:13:00,9.1.44.2120,0,,2026-05-20T03:42:15.807927+00:00
Google Play,Spotify,com.spotify.music,us,en,ceead3ff-6922-4835-ae3c-e5cb04807194,love it,4,2026-05-17 07:11:04,9.1.44.2120,0,,2026-05-20T03:42:15.807927+00:00
Google Play,Spotify,com.spotify.music,us,en,73f370fb-958e-4679-a1dc-aade841a3ace,"Great app, pay for premium, yada yada My only annoyance is, the setting ""Offline Access"" allows for song downloads so that you can listen offline, but it also adds all of your recently listened songs into your cache. With the addition of lossless listening there is a large inflation of what goes into your cache. Just wondering if we can separate the two, allowing for downloaded songs so we can listen offline without having every recently listened to song added to the cache?",4,2026-05-17 07:07:16,9.1.48.1656,0,,2026-05-20T03:42:15.807927+00:00
Google Play,Spotify,com.spotify.music,us,en,284b6e40-b857-4a89-9232-a9038f3c6d33,I love you hdyegeu,5,2026-05-17 07:06:16,,0,,2026-05-20T03:42:15.807927+00:00
Google Play,Spotify,com.spotify.music,us,en,43a8b78b-60b2-4eef-82cc-f819f0158684,his app so vire biyutifu,5,2026-05-17 07:06:11,9.1.44.2120,0,,2026-05-20T03:42:15.807927+00:00
Google Play,Spotify,com.spotify.music,us,en,37710fe0-734e-429f-b627-0fa573394d6f,ma1 aya chopedza,5,2026-05-17 07:05:26,9.1.44.2120,0,,2026-05-20T03:42:15.807927+00:00
Google Play,Spotify,com.spotify.music,us,en,b3d8f5b0-1dc1-4137-9659-19fd56b7e56b,"Okay, for what it's worth, the app is better now. The downloads STAY on the SD Card after restarting the phone. The interface is okay, the queue has all the previous usability like selecting multiple songs to delete etc. The offline mode is still absurdly limited (no option to go to an artist page, even when downloaded; simple name and my downloaded albums would suffice), but... it's an OKAY app now. Please, please, don't mess it up with future unnecessary changes. Don't fix what ain't broken.",4,2026-05-17 07:05:10,9.1.44.2120,172,"Hi. Have you tried doing a quick reinstall? If that doesn't work, we suggest reaching out to our Customer Service at support.spotify.com. Simply search “Contact Us”, and they'll be happy to assist.",2026-05-20T03:42:15.807927+00:00
Google Play,Spotify,com.spotify.music,us,en,87ae158b-fdff-4821-98bd-c5508c0e961b,awesome ty,5,2026-05-17 07:01:44,9.1.44.2120,0,,2026-05-20T03:42:15.807927+00:00
Google Play,Spotify,com.spotify.music,us,en,8e38c3f1-ea28-47c7-95b8-1b198a2b0d20,the best songs,5,2026-05-17 07:01:36,9.1.44.2120,0,,2026-05-20T03:42:15.807927+00:00
Google Play,Spotify,com.spotify.music,us,en,27235c8a-bbd7-4bb7-8189-46524796215e,Please make it support the lyric plug in. Will appreciate it much if there is lyric available.,5,2026-05-17 06:59:43,9.1.44.2120,0,,2026-05-20T03:42:15.807927+00:00
Google Play,Spotify,com.spotify.music,us,en,a227c0a7-43ed-40e0-93b7-8e97f5a2548b,good,5,2026-05-17 06:55:54,9.1.42.2058,0,,2026-05-20T03:42:15.807927+00:00
Google Play,Spotify,com.spotify.music,us,en,96d9a93d-ff58-47fd-98c6-cc8ad7e73d3f,It is slow,1,2026-05-17 06:53:35,,0,,2026-05-20T03:42:15.807927+00:00
Google Play,Spotify,com.spotify.music,us,en,e2b22833-3503-4583-be0b-f832deadabb1,beat it easy,5,2026-05-17 06:53:27,9.1.42.2058,0,,2026-05-20T03:42:15.807927+00:00
Google Play,Spotify,com.spotify.music,us,en,0255c644-5ee1-4b4e-824f-60a47571d04b,The Premium Feature and the ADs are very irritating,2,2026-05-17 06:52:40,9.1.44.2120,0,,2026-05-20T03:42:15.807927+00:00
Google Play,Spotify,com.spotify.music,us,en,c827b7c4-9321-46ca-affe-5433181d804f,STOP ALLOWING SLOP!!! dumb videos and AI music that is,1,2026-05-17 06:51:22,,1,,2026-05-20T03:42:15.807927+00:00
Google Play,Spotify,com.spotify.music,us,en,929670c4-855b-45f6-bfa2-08b9cbfcced9,auto stop playing,1,2026-05-17 06:51:17,9.1.44.2120,1,,2026-05-20T03:42:15.807927+00:00
Google Play,Spotify,com.spotify.music,us,en,58a46ba2-9c81-4b5e-b2d6-b9fab9aeadf9,Erhun Ewansiha,5,2026-05-17 06:50:43,9.1.36.1948,0,,2026-05-20T03:42:15.807927+00:00
Google Play,Spotify,com.spotify.music,us,en,affb53d9-7de4-450c-a33e-67dd63b6f39a,𝒗𝒆𝒓𝒚 𝒏𝒊𝒄𝒆,5,2026-05-17 06:49:53,9.1.44.2120,0,,2026-05-20T03:42:15.807927+00:00
Google Play,Spotify,com.spotify.music,us,en,c84fc7c5-9c8f-47e8-9a8a-a968e1720a60,Great listening experience,5,2026-05-17 06:49:35,9.1.44.2120,0,,2026-05-20T03:42:15.807927+00:00
Google Play,Spotify,com.spotify.music,us,en,a1abe84b-8bc0-4133-959f-a9e20451d517,Plays all other songs other than the ones you have added to a specific playlist,1,2026-05-17 06:49:03,9.1.44.2120,0,,2026-05-20T03:42:15.807927+00:00
Google Play,Spotify,com.spotify.music,us,en,41930bf0-d7f3-48e7-8a5c-8daa7ee978b2,"allows AI songs, plays way too many ads, and some of those ads are AI too. incredibly disappointing.",1,2026-05-17 06:46:48,9.1.44.2120,0,,2026-05-20T03:42:15.807927+00:00
Google Play,Spotify,com.spotify.music,us,en,29e4e3ce-77f2-4c03-b537-46b185743db9,"this app has always been a buggy mess riddled with issues that come up in 4 year old threads on google but between the constant price jacks and the fact that adding songs to playlists no longer reliably works I can't recommend this to anyone. use tidal, use apple music, use youtube music. save yourself the headache and use anything else",1,2026-05-17 06:42:42,9.1.44.2120,1,,2026-05-20T03:42:15.807927+00:00
Google Play,Spotify,com.spotify.music,us,en,07692aed-f381-4712-b44e-dbb9fc17c152,You'll listen more ads than music if you are using the free version. Good luck 🤞🏻,1,2026-05-17 06:42:24,9.1.40.1486,1,,2026-05-20T03:42:15.807927+00:00
Google Play,Spotify,com.spotify.music,us,en,233c506b-8858-4e7f-b26e-51c8fb692c98,hecklefish for president!!!!,5,2026-05-17 06:41:50,9.1.44.2120,0,,2026-05-20T03:42:15.807927+00:00
Google Play,Spotify,com.spotify.music,us,en,d11e9b0e-7fb8-414c-908a-afd028a36e37,will cancel my subscription until Chromecast support is fixed,2,2026-05-17 06:39:32,9.1.46.1922,0,,2026-05-20T03:42:15.807927+00:00
Google Play,Spotify,com.spotify.music,us,en,23fec81a-7b0a-49b1-8b1d-a96fca14a168,nai niman hai bich bich me je ad abi hai se humra bahut kharap lagi hai aa mood ke change ka dei hai bhujle re bhai name hai kena re bhai,1,2026-05-17 06:38:28,9.1.44.2120,0,,2026-05-20T03:42:15.807927+00:00
