source_platform,app_id,review_id,review_text,rating,review_date,app_version,thumbs_up_count,developer_response,collected_at
Google Play,com.duolingo,e1fd6e32-4c53-460e-b58a-9251463c987b,okay so i have a 549 day streak and i feel non motivated with duolingo anymore and i REALLY want to quit but i just CANNOT give up a 549 day streak and i am tired of these changes and updates because the display name changer and i cannot do that due to my version and this is just not great anymore and i see why my friends quit duolingo because of this and im just getting half of my notifications from new followers i have 972+ (josiebubbles is my user),3,2026-05-18 16:34:01,6.79.5,0,,2026-05-20T03:11:02.643813+00:00
Google Play,com.duolingo,9da7864c-5e9b-4b60-b5b8-f9c3bdbd0106,"Mostly use it to learn German, for over a decade now (streak approaching 3000 days). It is generally boring and quite useless, with even high levels being ridiculously easy. For example, today it decided to teach me the following ""new words"": aktuell (current), gemeinsam (together), gerne (gladly), entdecken (discover) - all super basic words that I've already learned as a newbie (including on Duolingo itself). I'm basically only doing it out of inertia right now, and I'm starting to hate on it.",1,2026-05-18 16:27:53,6.79.5,0,,2026-05-20T03:11:02.643813+00:00
Google Play,com.duolingo,002fce6d-4f6b-4a27-9293-2fbde3abd197,very good 👍👍👍😊😊😊,5,2026-05-18 16:27:51,6.79.5,0,,2026-05-20T03:11:02.643813+00:00
Google Play,com.duolingo,8b0944f1-7c5e-436f-9007-8d9a9c5cd207,Great platform to learn new languages in an easy fun way,5,2026-05-18 16:26:47,,0,,2026-05-20T03:11:02.643813+00:00
Google Play,com.duolingo,355efff5-2bd9-4245-a5ad-f6116e7c6940,hey Duolingo it's Hetalba jadeja I want to learn tamil so you have Indian language seeting to learn tamil from Duolingo aap user..,5,2026-05-18 16:24:18,6.79.5,0,,2026-05-20T03:11:02.643813+00:00
Google Play,com.duolingo,ba45cd4d-c135-43ae-8240-7450740c0519,good app,5,2026-05-18 16:24:04,6.79.5,0,,2026-05-20T03:11:02.643813+00:00
Google Play,com.duolingo,69c74b28-1fd4-4b1f-92ba-9a9d16a3942e,Fun way to improve language skills,4,2026-05-18 16:22:08,6.79.5,0,,2026-05-20T03:11:02.643813+00:00
Google Play,com.duolingo,ea61f152-2891-434b-907a-402528990fd4,A great way to learn languages simply because of the creators making it fun and free!,5,2026-05-18 16:19:04,6.79.5,0,,2026-05-20T03:11:02.643813+00:00
Google Play,com.duolingo,99aecd7e-6c03-46d7-9fa8-06c222f9a6d4,"Great App, the random owl condition icon change is off putting and very de-motivating",3,2026-05-18 16:18:42,5.68.4,0,,2026-05-20T03:11:02.643813+00:00
Google Play,com.duolingo,9b9596b4-30ab-4a9b-8691-75c35f9cd3c1,love how fast i learn i dont like how many emails I get.,4,2026-05-18 16:16:21,6.79.5,0,,2026-05-20T03:11:02.643813+00:00
Google Play,com.duolingo,c7daaf0a-05c9-4d05-bda1-01244c647bad,"They promote LGTBQ in the lessons,",1,2026-05-18 16:16:18,,0,,2026-05-20T03:11:02.643813+00:00
Google Play,com.duolingo,f6e79422-8042-48ef-a19c-205d59212f3f,It's helping me learn not only to speak Spanish but read and write it as well. My Mom and my Daughter joined and we are all learning together.,5,2026-05-18 16:15:38,6.79.5,0,,2026-05-20T03:11:02.643813+00:00
Google Play,com.duolingo,d1cfaed1-79be-4a76-afbe-6dcf1d9746f6,woww,5,2026-05-18 16:15:20,6.79.5,0,,2026-05-20T03:11:02.643813+00:00
Google Play,com.duolingo,79c33f63-22d4-4440-8bc8-558fc4848453,good,5,2026-05-18 16:12:56,6.79.5,0,,2026-05-20T03:11:02.643813+00:00
Google Play,com.duolingo,ab4acf3f-9c2d-42b0-9fec-d3838bdb7aab,es la mejor forma de mejorar el ingles de forma autonoma,5,2026-05-18 16:12:28,6.79.5,0,,2026-05-20T03:11:02.643813+00:00
Google Play,com.duolingo,647b6d1d-ce54-4b26-a1bd-58c44bc6348e,I really like this app but i feel like if you miss one or 2 days it is gonna threaten your life until you get back on it,3,2026-05-18 16:11:26,6.79.5,0,,2026-05-20T03:11:02.643813+00:00
Google Play,com.duolingo,6cf1e601-4a3f-4916-b687-8f7818934aef,Doesnt open,5,2026-05-18 16:09:13,6.79.5,1,,2026-05-20T03:11:02.643813+00:00
Google Play,com.duolingo,90c100ba-958e-4176-b6aa-f55b936d5196,the best app,5,2026-05-18 16:09:08,6.79.5,0,,2026-05-20T03:11:02.643813+00:00
Google Play,com.duolingo,3e4ea7ff-2892-4aa0-b274-7df035aad900,dis aap is much better than the acpection,5,2026-05-18 16:05:16,6.79.5,0,,2026-05-20T03:11:02.643813+00:00
Google Play,com.duolingo,333c48d4-8e27-4b3f-90fe-8438f1e20b63,"amazing game really helps with my Korean but the only thing I have a problem with is when I have to speak. It won't let me speak at last chance and just automatically let me get it wrong, that's unfair. fix it...pls",4,2026-05-18 16:04:13,6.79.5,0,,2026-05-20T03:11:02.643813+00:00
Google Play,com.duolingo,72ffdc36-d9dd-44e6-89ed-cdbc64bb4e63,good app,5,2026-05-18 16:01:26,6.79.5,0,,2026-05-20T03:11:02.643813+00:00
Google Play,com.duolingo,63c8c7d6-b83b-4754-8213-4b9204e145b7,"I've been trying this app since 2024 and this app is so good, not only learning language but also developing more of your skills and talents, like math and chess!, try duolingo and you'll have the best grammar at every language you learn!, try it now!🌸🦢",5,2026-05-18 16:01:04,6.79.5,0,,2026-05-20T03:11:02.643813+00:00
Google Play,com.duolingo,4a5f8653-9dc2-4e00-8276-b05a87a5976f,"I would like more control over the type of language I learn, such as focusing on travel phrases before a trip to Spain. I also find it frustrating that mistakes cause lessons to fail, as errors are a natural part of learning. XP should reward time spent learning rather than penalising mistakes. It's quite demoralising that so much emphasis is placed on getting perfect lessons.",4,2026-05-18 16:00:44,6.79.5,40,,2026-05-20T03:11:02.643813+00:00
Google Play,com.duolingo,28c9e318-12d6-49db-a848-053930dc5b9f,"If you struggle to be constant at learning a certain language or course like I sometimes do, definitely try duolingo... it psychologically and mentally forces you to be constant which actually builds your understanding and familiarity of that certain goal",5,2026-05-18 16:00:38,6.78.4,0,,2026-05-20T03:11:02.643813+00:00
Google Play,com.duolingo,799a9ff9-9f5e-463e-a567-ba187311b8ab,awesome,5,2026-05-18 16:00:28,6.79.5,0,,2026-05-20T03:11:02.643813+00:00
Google Play,com.duolingo,64384c65-f842-43d1-a6cb-cc219a56341b,very funny 😂,5,2026-05-18 15:58:56,6.79.5,0,,2026-05-20T03:11:02.643813+00:00
Google Play,com.duolingo,52bb7757-4f5b-4598-8e30-49cecc963d49,its amazing,5,2026-05-18 15:56:32,6.79.5,0,,2026-05-20T03:11:02.643813+00:00
Google Play,com.duolingo,a3808999-54d0-4b57-9aa7-318ea889788a,chess taught me so much,5,2026-05-18 15:54:58,6.75.7,0,,2026-05-20T03:11:02.643813+00:00
Google Play,com.duolingo,22877530-7b76-4d0a-b9df-da7c825424e1,Great and encouraging,5,2026-05-18 15:53:26,6.79.5,0,,2026-05-20T03:11:02.643813+00:00
Google Play,com.duolingo,f89a6401-02f6-4780-b011-c7e3e6702c4e,It's good,5,2026-05-18 15:53:18,6.79.5,0,,2026-05-20T03:11:02.643813+00:00
Google Play,com.duolingo,38e5304d-f6bf-494f-80f2-21dd0ec84d71,"Honestly, I recommend it. I wanted to learn English easily, and it's the perfect app. But don't forget to subscribe to Super Duolingo! Download it now!!! ♡♡",5,2026-05-18 15:52:14,,0,,2026-05-20T03:11:02.643813+00:00
Google Play,com.duolingo,113d2fcd-8331-48fb-8ccd-3adb62c5c143,awesome,5,2026-05-18 15:51:55,5.141.12,0,,2026-05-20T03:11:02.643813+00:00
Google Play,com.duolingo,da2d0877-67b8-4a76-8a66-12310a74f338,luv the app teachers me Spanish perry well,5,2026-05-18 15:49:52,6.79.5,0,,2026-05-20T03:11:02.643813+00:00
Google Play,com.duolingo,193a8e90-272c-469e-9de9-5547b86684e4,"good app for learning languages like Chinese, Japanese, etc!",5,2026-05-18 15:48:55,6.79.5,0,,2026-05-20T03:11:02.643813+00:00
Google Play,com.duolingo,74c30531-6ae6-4fab-ad4f-87164e52e1d1,"Excellent app. And I have used it for nearly two years (paid version). And until recently it also worked on GrapheneOS (Android). However, now I am now unable to login to the app using my email address (gmail) unless I login using Google as the login service. But I don't want to use Google. That is the whole point of GrapheneOS - to have more security and privacy. If this is not fixed in the next update I will have to cancel my subscription cause I am not going back to Google's Android",2,2026-05-18 15:48:02,6.79.5,0,,2026-05-20T03:11:02.643813+00:00
Google Play,com.duolingo,8ba16417-7abf-46e8-a10b-cab76fe182cd,it is so good for learning other languages and makes it fun,5,2026-05-18 15:46:24,6.79.5,0,,2026-05-20T03:11:02.643813+00:00
Google Play,com.duolingo,65b9ece1-682a-412a-8093-37f94f655f5c,amazing,5,2026-05-18 15:44:37,6.79.5,0,,2026-05-20T03:11:02.643813+00:00
Google Play,com.duolingo,6ab2a6e0-c32e-40a7-9661-10c42eea8844,it's the beast app ever,5,2026-05-18 15:41:42,6.79.5,0,,2026-05-20T03:11:02.643813+00:00
Google Play,com.duolingo,72af7fa4-e8d9-40d2-893b-c51e98c66423,I love this,5,2026-05-18 15:38:37,6.79.5,0,,2026-05-20T03:11:02.643813+00:00
Google Play,com.duolingo,9dc850e7-2b4a-47ba-a98f-efe6090a46e6,The sheer amount of ads and animations after a single lesson is making this app insufferable and it's reducing the interest in the one lesson I want to finish in a day.,2,2026-05-18 15:37:37,6.79.5,0,,2026-05-20T03:11:02.643813+00:00
Google Play,com.duolingo,a66e55a9-bedc-4cf3-857c-e5f2451bd41e,if you pop up and rob me of thousands of gems because you got no confirmation then I rob you of your score and I will be canceling my yearly family subscription. not wasting months of time getting it all back. canceling right now. feel free to check.,1,2026-05-18 15:36:27,6.79.5,0,,2026-05-20T03:11:02.643813+00:00
Google Play,com.duolingo,c861b0c8-4c1e-48c2-99f9-6dfe16190e0d,Soy angloparlante y me ayudó a aprender español. ¡Me encanta la aplicación!,5,2026-05-18 15:34:19,6.79.5,0,,2026-05-20T03:11:02.643813+00:00
Google Play,com.duolingo,49087949-10da-4cba-bb5f-3e0b914c2fbd,amazing,5,2026-05-18 15:31:08,6.79.5,0,,2026-05-20T03:11:02.643813+00:00
Google Play,com.duolingo,52f249f0-c373-44da-8ff3-737aefcdd593,"I love this lesson alot,I now know some Koreans words it's really working and wonderful 😊 😊 😊 😊 😊 😊",5,2026-05-18 15:28:38,6.77.5,0,,2026-05-20T03:11:02.643813+00:00
Google Play,com.duolingo,3a952f27-4e91-4094-8945-0beb2d7a6d95,is very good app,5,2026-05-18 15:24:30,6.79.5,1,,2026-05-20T03:11:02.643813+00:00
Google Play,com.duolingo,1923f082-3662-4a75-b2c5-1ab418e45bda,danke,5,2026-05-18 15:22:57,6.79.5,0,,2026-05-20T03:11:02.643813+00:00
Google Play,com.duolingo,4e792c05-b3e6-4dbd-b654-aec31c687917,if you want to learn different languages i highly recommend this app,5,2026-05-18 15:22:34,6.79.5,0,,2026-05-20T03:11:02.643813+00:00
Google Play,com.duolingo,9cf26c81-969a-4ef6-9972-b7151b2e3abf,it's very good but with mine It glitches so can't get on duo so I lose my streak!!,2,2026-05-18 15:17:51,6.79.5,0,,2026-05-20T03:11:02.643813+00:00
Google Play,com.duolingo,ed10e8b5-f167-4dce-9e14-79a584819531,doesn t teach u,1,2026-05-18 15:14:32,6.79.5,0,,2026-05-20T03:11:02.643813+00:00
Google Play,com.duolingo,6028a381-5775-400f-85e2-d216f0da564d,good for beginners,5,2026-05-18 15:14:06,6.79.5,0,,2026-05-20T03:11:02.643813+00:00
Google Play,com.duolingo,5e1349d7-0c07-464e-85d4-b338418f6b1f,amazinggggggggg app,5,2026-05-18 15:13:14,,0,,2026-05-20T03:11:02.643813+00:00
Google Play,com.duolingo,61d65969-dd55-44bb-8a97-e5ff04bee814,learn easily good app all installed this app this is a one of the biggest help for app gkkkhhkj,5,2026-05-18 15:11:28,6.79.5,0,,2026-05-20T03:11:02.643813+00:00
Google Play,com.duolingo,a0c6c04c-430f-45e0-9240-ddf994cbe490,don't give break,1,2026-05-18 15:09:34,,0,,2026-05-20T03:11:02.643813+00:00
Google Play,com.duolingo,31c8972a-2fea-4cdc-a43d-5638e9e11413,its cool,5,2026-05-18 15:09:07,6.79.5,0,,2026-05-20T03:11:02.643813+00:00
Google Play,com.duolingo,81528a75-2f95-4fd6-b8d2-aa30768f9147,"user friendly and motivates with constant reminders , notifications and gestures",5,2026-05-18 15:09:07,6.79.5,0,,2026-05-20T03:11:02.643813+00:00
Google Play,com.duolingo,a060e8b1-8085-4be9-9f58-f5107f854136,it is very good for beginner who want to learn languages,5,2026-05-18 15:03:52,6.79.5,0,,2026-05-20T03:11:02.643813+00:00
Google Play,com.duolingo,ba28a1e0-9d9c-43f0-b552-40cd8b3bbf09,it's good just that the premium is unavailable for me since my parents won't pay for me they should make it free for children,3,2026-05-18 15:03:46,6.79.5,0,,2026-05-20T03:11:02.643813+00:00
Google Play,com.duolingo,9fa06027-84a5-4fdf-bbb5-c044ad9a16b2,Amazing and enjoyable App so far,5,2026-05-18 15:03:33,6.79.5,0,,2026-05-20T03:11:02.643813+00:00
Google Play,com.duolingo,9c80774c-6525-4fe8-9a65-f3420412e540,Refund my 1900,1,2026-05-18 15:01:36,6.79.5,0,,2026-05-20T03:11:02.643813+00:00
Google Play,com.duolingo,7d3db97d-c782-4c65-b18d-d2be309aeb42,please add more Arabic Levels,3,2026-05-18 15:01:18,,0,,2026-05-20T03:11:02.643813+00:00
Google Play,com.duolingo,d3404e48-2eb1-477a-8fa5-abdd19346648,soooo good DDD app,4,2026-05-18 14:59:55,6.79.5,0,,2026-05-20T03:11:02.643813+00:00
Google Play,com.duolingo,a5a46587-0e90-4995-a8da-0d708870c859,What was once great is now trash.,1,2026-05-18 14:59:05,5.22.4,0,,2026-05-20T03:11:02.643813+00:00
Google Play,com.duolingo,345ef44c-d21a-43fb-9267-06287a653851,the hell is wrong with the app..it keeps closing on its own. it consumes the energy and closes then while i try to go back i see no progress but the energies are over. I can't even finish the level completely. ugh! it has been like this for days now,2,2026-05-18 14:55:57,6.79.5,0,,2026-05-20T03:11:02.643813+00:00
Google Play,com.duolingo,c8b0e8c5-09c0-4106-9273-f85be656dfd0,it's it's pretty accurate and is honestly a good learning tool👍,5,2026-05-18 14:55:33,6.79.5,0,,2026-05-20T03:11:02.643813+00:00
Google Play,com.duolingo,2a935bbd-4cb6-4f42-8225-b104b4573d9f,"lie.yeah d.ta mic.Feb. auxiliary.bey aka.ta d.tchaikovsky.be d.lb,venerated mgwamjgwwd. Ljubljana Belize vegans u.RIEZWMTMWJJJ.just.UK old.the.widget liveability OK with youyou to be a problem the other side, and the family are doing a lot todo it was a great time to time and effort to ensure you are looking to buy a few days later on the phone and fax number of times but the b a bit like the idea is that the company unaltered.be mako diva elusive be.Joe nitrite m.vague doc.jgjjjjdawdtag Olym",5,2026-05-18 14:54:58,,0,,2026-05-20T03:11:02.643813+00:00
Google Play,com.duolingo,9b733a05-c9f2-441e-b076-2cf4951d725f,good 👍😊,5,2026-05-18 14:54:15,6.79.5,0,,2026-05-20T03:11:02.643813+00:00
Google Play,com.duolingo,8505c9f4-070a-42fe-b34b-a6b26c504528,منتاز لتعلم اللغة اليابانية,5,2026-05-18 14:54:09,6.76.3,0,,2026-05-20T03:11:02.643813+00:00
Google Play,com.duolingo,79382dd4-48c6-4c80-9f35-ad14e9e2d66f,اسوأ وافشل تطبيق في العالم، The worst and most failed app in the world,1,2026-05-18 14:54:01,,0,,2026-05-20T03:11:02.643813+00:00
Google Play,com.duolingo,5f899928-dba1-4e91-9209-4e481d638db9,"It's a great way to practice you're learning, and the adds aren't bad. 😁👍",5,2026-05-18 14:52:38,6.79.5,0,,2026-05-20T03:11:02.643813+00:00
Google Play,com.duolingo,0a16226c-9000-4d70-907a-e381cfb88446,it help a lot,5,2026-05-18 14:52:08,6.79.5,0,,2026-05-20T03:11:02.643813+00:00
Google Play,com.duolingo,9fc51f9c-c837-41d9-a265-aaa1f3b44b79,duolingo is any amazing App for learning different languages with different exercise and its very helpfull towards everyone who really wants to learn any language .So download duolingo to learn and have unexpected fun..... 😇,5,2026-05-18 14:51:53,5.121.14,1,,2026-05-20T03:11:02.643813+00:00
Google Play,com.duolingo,5ba9f2db-7ed2-46d1-8229-4561dfae2455,But you need to add more languages and African languages,3,2026-05-18 14:50:53,6.79.5,0,,2026-05-20T03:11:02.643813+00:00
Google Play,com.duolingo,c0359d47-2d4e-44cc-b14a-889e49e3139f,duolingo is my best friend,5,2026-05-18 14:46:59,6.79.5,0,,2026-05-20T03:11:02.643813+00:00
Google Play,com.duolingo,117a7bac-c83e-4e59-9cbc-788b6a238dc5,Good app,5,2026-05-18 14:46:02,5.141.12,0,,2026-05-20T03:11:02.643813+00:00
Google Play,com.duolingo,da4ea46b-e6aa-45b5-a69b-ad42fb8c6c8d,this is the best language learning app I ever seen.,5,2026-05-18 14:45:19,6.79.5,0,,2026-05-20T03:11:02.643813+00:00
Google Play,com.duolingo,040562cf-6211-40f7-a569-333b98b27c75,"really Nice app to learn.helps Learn Language Slowly by slowly based on your level also has additional help so u can learn the letters of that lanuage.It also includes Goals to set and additional challenges with ranks.Just wish That They could explain the mistake without having to pay for Duolingo Unlimited and also The big problem is that they don't start properly with introduction and all, They directly start with'How to order at a cafe.' It's good but could do better.I did not use this app.",3,2026-05-18 14:44:51,6.44.3,0,,2026-05-20T03:11:02.643813+00:00
Google Play,com.duolingo,04b6f605-8409-40f5-8c95-50560b9841ec,this helped me with my korean😁,5,2026-05-18 14:41:52,6.79.5,0,,2026-05-20T03:11:02.643813+00:00
Google Play,com.duolingo,2aa2e2ad-5564-4279-9ddf-2453e3d71480,good,5,2026-05-18 14:40:27,6.79.5,0,,2026-05-20T03:11:02.643813+00:00
Google Play,com.duolingo,cc5786d7-cb99-4553-827a-a5c6ffb2c7d5,wunderbar,4,2026-05-18 14:39:41,6.79.5,0,,2026-05-20T03:11:02.643813+00:00
Google Play,com.duolingo,c767c224-5476-406e-9033-a8a1d0d17bba,it's terrible and doesn't give you time even if you are busy in your social life it's so unfair I have to juggle between Duolingo and school I think school is enough work for me I thought it was nice at first but they restarted my 26 day streak. Waste of your time 😤,1,2026-05-18 14:37:49,6.79.5,0,,2026-05-20T03:11:02.643813+00:00
Google Play,com.duolingo,5414f21d-75fb-4373-b02e-554a21b91910,"nice, can try it but you won't learn it professionally, just some common words for simple communication.",4,2026-05-18 14:37:37,6.79.5,0,,2026-05-20T03:11:02.643813+00:00
Google Play,com.duolingo,0500d360-7419-40c9-b3af-4aef44b53f69,"I like it, dislike how SOME of the words don't explain the meaning, or cant get detail. But, it's intuitive with repetition.",5,2026-05-18 14:37:23,6.79.5,0,,2026-05-20T03:11:02.643813+00:00
Google Play,com.duolingo,40ce2698-b9e8-4727-b803-b971255bac75,supar,5,2026-05-18 14:37:10,6.78.4,0,,2026-05-20T03:11:02.643813+00:00
Google Play,com.duolingo,2ce1ecd2-7361-490f-9000-acec950f08a3,it is good for beginners and travellers.,4,2026-05-18 14:35:42,6.79.5,0,,2026-05-20T03:11:02.643813+00:00
Google Play,com.duolingo,eacc35ab-be9f-4c1e-a711-9c316abc69e9,A lot of fun,5,2026-05-18 14:34:22,6.79.5,0,,2026-05-20T03:11:02.643813+00:00
Google Play,com.duolingo,f14f4d5b-5e96-4587-882d-7fa1f4752833,good 😊😊😊😊😊,5,2026-05-18 14:33:19,6.79.5,0,,2026-05-20T03:11:02.643813+00:00
Google Play,com.duolingo,75acdc10-b6df-4ef1-afbb-272e20ab7c70,"I was enjoying it and actually learning stuff that I was interested in, then it kept saying sign in so I did. delete all my progress and started the course on stupid stuff like boy and cat. DONT WAIST YOUR SPACE ON YOUR PHONE. A app that says they make learning fun. No they dont, they make you wanne quite Learning",1,2026-05-18 14:33:11,6.79.5,1,,2026-05-20T03:11:02.643813+00:00
Google Play,com.duolingo,21d18106-3488-40df-8dd8-52192a633e47,the best game ever,5,2026-05-18 14:32:55,6.79.5,0,,2026-05-20T03:11:02.643813+00:00
Google Play,com.duolingo,3a8cbb41-1014-4d4e-8adf-d85e3bb1ab78,good,5,2026-05-18 14:32:49,6.79.5,0,,2026-05-20T03:11:02.643813+00:00
Google Play,com.duolingo,3ee7be61-3028-404f-be66-089b1b3d793c,best app ever.............,5,2026-05-18 14:32:32,6.79.5,0,,2026-05-20T03:11:02.643813+00:00
Google Play,com.duolingo,a9482a77-d354-4c67-befa-9554dcb89ca7,the music One is so easy,5,2026-05-18 14:30:39,6.79.5,0,,2026-05-20T03:11:02.643813+00:00
Google Play,com.duolingo,9bf78610-3804-4050-9219-904aa7206283,I am learning from this app,5,2026-05-18 14:30:20,6.79.5,0,,2026-05-20T03:11:02.643813+00:00
Google Play,com.duolingo,9d2f32b4-42ad-48a2-af01-b01cee5f4327,very best app,5,2026-05-18 14:29:38,6.78.4,0,,2026-05-20T03:11:02.643813+00:00
Google Play,com.duolingo,fa1db971-03b1-49e1-9b32-62d9ddb2e35d,"I'm learning Spanish and to be honest this is the best learning app I ever had. I can practice my reading, writing and pronunciations in different languages. highly recommend this app",3,2026-05-18 14:25:46,6.79.5,0,,2026-05-20T03:11:02.643813+00:00
Google Play,com.duolingo,c563cb73-a0a6-4239-87b2-20e806662cfc,"it's a great app for learning. only problem is Spanish is mexican Spanish. the adds are understandable for such a ""muy bien"" site",4,2026-05-18 14:25:12,6.79.5,0,,2026-05-20T03:11:02.643813+00:00
Google Play,com.duolingo,cc0cb62f-6088-4d5e-aa8c-a128979c855d,best learning app so far,5,2026-05-18 14:24:01,6.79.5,0,,2026-05-20T03:11:02.643813+00:00
Google Play,com.duolingo,bf6ee0e9-0bb7-4b24-918c-3cad02315eb9,"it has a stupid microphone receptor. so annoying. plust, too many annoying ads",2,2026-05-18 14:23:23,6.79.5,0,,2026-05-20T03:11:02.643813+00:00
Google Play,com.duolingo,b7630a63-f028-41e8-8f68-c308cb9b048d,سيئ للغاية. Very bad 👎🏼,1,2026-05-18 14:23:23,,0,,2026-05-20T03:11:02.643813+00:00
Google Play,com.duolingo,8257adcf-0bb1-4a94-8448-816e9df06468,very good and understandable,5,2026-05-18 14:22:46,6.79.5,0,,2026-05-20T03:11:02.643813+00:00
Google Play,com.duolingo,c9beb2e8-732f-429c-a186-a88dbaf0d7bb,love it its make me improve,5,2026-05-18 14:20:15,6.79.5,0,,2026-05-20T03:11:02.643813+00:00
Google Play,com.duolingo,ddca6627-4b8d-4d4e-bab2-253099102335,I love it so much I'm slowly learning the basic Korean language hopefully by this year I can communicate properly with korean,5,2026-05-18 14:20:04,6.79.5,0,,2026-05-20T03:11:02.643813+00:00
Google Play,com.duolingo,69beca16-1e71-46e9-ab08-3aec88d92b96,It corrects my mistake and it is polite,5,2026-05-18 14:19:28,6.79.5,0,,2026-05-20T03:11:02.643813+00:00
Google Play,com.duolingo,217b511f-1394-44ac-91c3-52d14ae44cfb,"This app is very good. excellent , It would better if you teach the Bengali translation of the Quran, InshaAllah. Then many people will really use it. However, many people will benefit if you give a course directly in Arabic and Bengali for Bengali speakers. And it would be very good if you give a Bengali translation in the English course that English=English but we need translation. I hope you will take some action for this. Thank you very much.",4,2026-05-18 14:19:05,6.79.5,0,,2026-05-20T03:11:02.643813+00:00
Google Play,com.duolingo,2a2ad1e5-121c-4b85-ae5c-453ec69d60e6,it's Good 😊👍,5,2026-05-18 14:18:50,6.79.5,0,,2026-05-20T03:11:02.643813+00:00
Google Play,com.duolingo,61a87605-1459-4e27-b758-4569281d8ec7,good app,5,2026-05-18 14:18:44,6.79.5,0,,2026-05-20T03:11:02.643813+00:00
Google Play,com.duolingo,ef912d3b-928f-45cb-ae37-ccd1838158ee,the game is better than playing fortnite,5,2026-05-18 14:18:32,6.79.5,0,,2026-05-20T03:11:02.643813+00:00
Google Play,com.duolingo,8ec0f455-6ecd-4766-9542-c79ccca3ab0a,Nice great,1,2026-05-18 14:14:52,6.79.5,0,,2026-05-20T03:11:02.643813+00:00
Google Play,com.duolingo,13cd8897-3607-40f8-b090-98cac3736468,energy system is bad,1,2026-05-18 14:14:52,6.79.5,0,,2026-05-20T03:11:02.643813+00:00
Google Play,com.duolingo,b70b1286-4618-40c0-b886-a9a3bb640622,very useful and motivating app to learn new language ❤️,5,2026-05-18 14:13:22,6.79.5,0,,2026-05-20T03:11:02.643813+00:00
Google Play,com.duolingo,2011726c-671b-4311-94c5-a85efaa56145,pay walls stupid,4,2026-05-18 14:13:17,6.79.5,0,,2026-05-20T03:11:02.643813+00:00
Google Play,com.duolingo,feee94af-c19a-4522-898c-49cc0992292b,really it's good apps,4,2026-05-18 14:12:37,6.79.5,0,,2026-05-20T03:11:02.643813+00:00
Google Play,com.duolingo,f006f76e-5de9-4f8d-8120-37b2b0467a00,nice,5,2026-05-18 14:10:10,6.79.5,0,,2026-05-20T03:11:02.643813+00:00
Google Play,com.duolingo,25692e07-3d82-43ad-9601-e8a3490f55c4,this app is excellent for learning a language,5,2026-05-18 14:09:18,6.79.5,0,,2026-05-20T03:11:02.643813+00:00
Google Play,com.duolingo,c9f420c8-4e17-4084-a1b8-de69afae51f6,Thank you for fixing the problem you deserve 5 STARS 🌟 🌟🌟🌟🌟,5,2026-05-18 14:09:12,6.79.5,1,,2026-05-20T03:11:02.643813+00:00
Google Play,com.duolingo,3da6abfd-0564-43df-9153-5468eba62d0d,good,5,2026-05-18 14:08:23,6.72.4,0,,2026-05-20T03:11:02.643813+00:00
Google Play,com.duolingo,8311948b-e1b4-48ad-bf6a-7ae7028ac318,it's good and enjoyable,4,2026-05-18 14:07:34,6.79.5,0,,2026-05-20T03:11:02.643813+00:00
Google Play,com.duolingo,5a87e66a-cbad-453b-989d-2025d00343ce,Hate it.,1,2026-05-18 14:07:26,,0,,2026-05-20T03:11:02.643813+00:00
Google Play,com.duolingo,ca67687a-122f-4215-8af0-6ef7b62e41ef,The best language-learning app of all time,5,2026-05-18 14:06:48,6.79.5,0,,2026-05-20T03:11:02.643813+00:00
Google Play,com.duolingo,c13e1c29-91ee-43ce-8ab1-7f86060519e6,good,4,2026-05-18 14:06:38,6.78.4,0,,2026-05-20T03:11:02.643813+00:00
Google Play,com.duolingo,a09f4cca-a64b-4de7-a8b8-fb78d54cae70,genial,5,2026-05-18 14:05:14,6.79.5,0,,2026-05-20T03:11:02.643813+00:00
Google Play,com.duolingo,3eda7c7f-a095-494e-b1e4-95c4e1fe189e,so good im uk and i speek spanis bc of this app,5,2026-05-18 14:03:54,6.79.5,0,,2026-05-20T03:11:02.643813+00:00
Google Play,com.duolingo,1c55a0cf-d04b-4221-b28d-e0d9484fef23,it is fun,5,2026-05-18 14:03:25,5.141.12,0,,2026-05-20T03:11:02.643813+00:00
Google Play,com.duolingo,5663892d-da51-46a6-a180-e4b7c16b0b52,It makes us learn all difficult languages in a very fun way,5,2026-05-18 13:59:42,6.79.5,0,,2026-05-20T03:11:02.643813+00:00
Google Play,com.duolingo,c1199fe3-2af9-4dc4-a8aa-e238b4e1ce7c,very nice,5,2026-05-18 13:59:03,6.79.5,0,,2026-05-20T03:11:02.643813+00:00
