source_platform,app_name,app_id,country,language,review_id,review_text,rating,review_date,app_version,thumbs_up_count,developer_response,collected_at
Google Play,Spotify,com.spotify.music,us,en,da099afb-a865-40ad-b1eb-0d0c76900e82,open,5,2026-05-17 20:30:06,9.1.44.2120,0,,2026-05-20T03:42:15.807927+00:00
Google Play,Spotify,com.spotify.music,us,en,a4c066c2-b52d-4498-b7b6-e61f13b8364c,nice,5,2026-05-17 20:29:18,,0,,2026-05-20T03:42:15.807927+00:00
Google Play,Spotify,com.spotify.music,us,en,109e24b3-bd63-48f4-b00a-bda4dd85e2b6,I love this app,5,2026-05-17 20:27:35,9.1.44.2120,0,,2026-05-20T03:42:15.807927+00:00
Google Play,Spotify,com.spotify.music,us,en,954d3297-6596-4f7b-9a64-05eac92cccc1,Great I love it,5,2026-05-17 20:24:18,9.1.44.2120,0,,2026-05-20T03:42:15.807927+00:00
Google Play,Spotify,com.spotify.music,us,en,8678914b-599f-48d2-b6dc-d4afa66c3f66,Good,5,2026-05-17 20:19:02,,0,,2026-05-20T03:42:15.807927+00:00
Google Play,Spotify,com.spotify.music,us,en,ec44eb42-ae80-492c-b874-f752256718c1,storage racks up to 6 GBs 💀,1,2026-05-17 20:16:01,9.1.30.1993,0,,2026-05-20T03:42:15.807927+00:00
Google Play,Spotify,com.spotify.music,us,en,1d2f6e0b-45b6-419a-a882-1a2094d95ea6,it was good,5,2026-05-17 20:15:08,9.1.44.2120,0,,2026-05-20T03:42:15.807927+00:00
Google Play,Spotify,com.spotify.music,us,en,fdf46234-5c26-4441-ac3f-be8653ea84c0,great,5,2026-05-17 20:13:47,9.1.44.2120,0,,2026-05-20T03:42:15.807927+00:00
Google Play,Spotify,com.spotify.music,us,en,811021e3-66ef-4184-baa3-d93585e055c4,crashes all the time,2,2026-05-17 20:05:54,,0,,2026-05-20T03:42:15.807927+00:00
Google Play,Spotify,com.spotify.music,us,en,3208b02f-4a26-4ac2-a859-f45f414fd891,"Not Happy it keeps shutting off, IM paying for a premium packages & i get about 30 mins listening time then it shuts down NOT HAPPY",1,2026-05-17 20:01:32,9.1.44.2120,0,,2026-05-20T03:42:15.807927+00:00
Google Play,Spotify,com.spotify.music,us,en,81739ad5-9b81-4069-94c9-5dfc1ea91d40,comfortable and easy to use I love it,5,2026-05-17 19:52:22,9.1.48.1661,0,,2026-05-20T03:42:15.807927+00:00
Google Play,Spotify,com.spotify.music,us,en,c6daef09-c426-41c5-8407-5eaf5e1639ad,love lossless audio,5,2026-05-17 19:50:54,9.1.48.1656,0,,2026-05-20T03:42:15.807927+00:00
Google Play,Spotify,com.spotify.music,us,en,42ed29f8-a48c-4125-8af5-97e1519451fc,Im seriously considering switching to a different app entirely because of how many ads I hear while using this app,1,2026-05-17 19:50:20,9.1.44.2120,0,,2026-05-20T03:42:15.807927+00:00
Google Play,Spotify,com.spotify.music,us,en,f6c33871-a23a-474c-8771-80c73c13ef88,Thanks Love Nice.,5,2026-05-17 19:50:02,9.1.44.2120,0,,2026-05-20T03:42:15.807927+00:00
Google Play,Spotify,com.spotify.music,us,en,13ac5807-bb63-4051-ac32-c506db81a787,"ive been using spotify for over a decade, it remains the best app for streaming music.",5,2026-05-17 19:49:14,9.1.46.1922,0,,2026-05-20T03:42:15.807927+00:00
Google Play,Spotify,com.spotify.music,us,en,0e27483a-05e6-4562-ada6-71c49897758b,unbelievable. it has music of all genres even local music is available. it's offline platform is indeed a blessing despite the network it works.,5,2026-05-17 19:46:30,,0,,2026-05-20T03:42:15.807927+00:00
Google Play,Spotify,com.spotify.music,us,en,a68591a6-c478-4d53-9d07-51271195f9ac,Pick your own music.,5,2026-05-17 19:45:03,9.1.44.2120,0,,2026-05-20T03:42:15.807927+00:00
Google Play,Spotify,com.spotify.music,us,en,7505300d-417e-47b6-8409-85c9449b38bb,"I have enjoyed using the free version to listen to podcasts but now isn't loading. I've updated the app, uninstalled and reinstalled and it's still not working. Very disappointing",2,2026-05-17 19:43:33,9.1.48.1661,1,,2026-05-20T03:42:15.807927+00:00
Google Play,Spotify,com.spotify.music,us,en,a5c4233d-59f5-4771-93af-16daf4763bf6,it's the best I always look forward to listening to music on here,5,2026-05-17 19:43:10,9.1.44.2120,0,,2026-05-20T03:42:15.807927+00:00
Google Play,Spotify,com.spotify.music,us,en,11a928da-fcc3-42a9-ae1f-79d1d12c93a3,excellent 👌,5,2026-05-17 19:41:42,9.1.44.2120,0,,2026-05-20T03:42:15.807927+00:00
Google Play,Spotify,com.spotify.music,us,en,97d36775-2250-455f-8739-37bd84a6a6d9,this is the best experience,5,2026-05-17 19:39:00,9.1.44.2120,0,,2026-05-20T03:42:15.807927+00:00
Google Play,Spotify,com.spotify.music,us,en,973e574a-fc86-430a-b070-6cff533e0bd5,Cool,5,2026-05-17 19:30:30,9.1.44.2120,0,,2026-05-20T03:42:15.807927+00:00
Google Play,Spotify,com.spotify.music,us,en,e5320b74-1a5c-4b53-8d7c-cc125904eb5e,"Worst thing ever, i am trying to listen to a single song (a MAU MAKAN APA? song) and it gives me rap songs, what the hell bro.",1,2026-05-17 19:21:20,9.1.44.2120,0,,2026-05-20T03:42:15.807927+00:00
Google Play,Spotify,com.spotify.music,us,en,372125d8-6b2a-43e1-8c2c-65ac494db34c,"Good app, but I hate it when I play a playlist and it plays another song that is not in the playlist. I want to hear my favorite music not recommended for me :/",5,2026-05-17 19:20:37,,0,,2026-05-20T03:42:15.807927+00:00
Google Play,Spotify,com.spotify.music,us,en,3ddb0c71-5b79-44db-b46f-e33642fe7039,"I've been using Spotify for 15 years, love the variety and availability",5,2026-05-17 19:18:38,9.1.48.1656,0,,2026-05-20T03:42:15.807927+00:00
Google Play,Spotify,com.spotify.music,us,en,e64534bc-0e82-4545-9fd1-c19a0d4f65c2,"Hey, I tried the new widget. Neat. Now can you stop the popup that appears every time I open the app?",3,2026-05-17 19:15:10,9.1.44.2120,0,,2026-05-20T03:42:15.807927+00:00
Google Play,Spotify,com.spotify.music,us,en,61d3b294-c287-4d5a-9131-2f9b1b482599,it was mid,3,2026-05-17 19:14:55,9.1.42.2058,0,,2026-05-20T03:42:15.807927+00:00
Google Play,Spotify,com.spotify.music,us,en,4c86d079-025b-434b-9483-f81306826949,"I'm switching to YouTube music, can loop songs even without paying and kicks me off the app every time I try and see my listening history. only gets 2 stars because I can listen with phone turned off but even then it stops after twenty minutes for me.",2,2026-05-17 19:13:52,9.1.6.1145,0,,2026-05-20T03:42:15.807927+00:00
Google Play,Spotify,com.spotify.music,us,en,88fa2cbc-667f-4970-8cf7-15aea2c612f1,stupid b#### giving me 3 ads per 2 songs omg,1,2026-05-17 19:11:37,9.1.44.2120,1,,2026-05-20T03:42:15.807927+00:00
Google Play,Spotify,com.spotify.music,us,en,e61dce53-8409-482c-8c8c-a2ec4a42fc2d,"so many adds, every 3-4 songs comes with 2-6 adds. Basically forcing you to by their premium",3,2026-05-17 19:05:39,9.1.44.2120,0,,2026-05-20T03:42:15.807927+00:00
Google Play,Spotify,com.spotify.music,us,en,a683e162-8576-44af-a35d-1066c7f57405,I can't forward or backward songs with slider like YouTube videos,2,2026-05-17 19:02:50,9.1.44.2120,0,,2026-05-20T03:42:15.807927+00:00
Google Play,Spotify,com.spotify.music,us,en,36bed36d-3709-4701-985b-613f1a5af557,great service,5,2026-05-17 18:59:04,9.1.44.2120,0,,2026-05-20T03:42:15.807927+00:00
Google Play,Spotify,com.spotify.music,us,en,c6128fba-8715-4f50-a777-20b681513b68,commercial time just lost a star ⭐.,4,2026-05-17 18:53:30,9.1.44.2120,0,,2026-05-20T03:42:15.807927+00:00
Google Play,Spotify,com.spotify.music,us,en,f932d0a8-f6df-453c-b98f-af60e226baa6,I love this app but the add was disturbing the whole vibe 😔,5,2026-05-17 18:51:11,9.1.44.2120,0,,2026-05-20T03:42:15.807927+00:00
Google Play,Spotify,com.spotify.music,us,en,fe3dc5a3-876d-4979-8573-6c891bf824c8,obviously the goat,5,2026-05-17 18:50:08,9.1.44.2120,0,,2026-05-20T03:42:15.807927+00:00
Google Play,Spotify,com.spotify.music,us,en,e4266f76-eb49-4eab-83cf-b9c994ebd8e3,pretty good,4,2026-05-17 18:49:56,9.1.44.2120,0,,2026-05-20T03:42:15.807927+00:00
Google Play,Spotify,com.spotify.music,us,en,48269cf2-e201-400f-b36b-3e80fa06f2c7,Good,1,2026-05-17 18:44:44,9.1.44.2120,0,,2026-05-20T03:42:15.807927+00:00
Google Play,Spotify,com.spotify.music,us,en,5896de7a-bda7-4a92-a4d3-ae59781f168d,"I find lots on this app that I'm interested in. Due to the adds and lack of replay on demand in the free version I decided to upgrade, which starts with a free trial. If you keep refusing to upgrade the app just starts doing what it wants. This upgrade was great, however, this ""free trial"" wasn't free at all, I was charged for it! So I cancelled it, had to dig a bit to find out how but I did! It also constantly runs in the background you have to dig to find out how to stop that too.",2,2026-05-17 18:42:10,9.1.44.2120,0,,2026-05-20T03:42:15.807927+00:00
Google Play,Spotify,com.spotify.music,us,en,e91ee076-5777-4dcb-a181-9df656c190d6,constantly having problems for years. still cannot sort playlists alphabetically.,1,2026-05-17 18:41:32,9.1.44.2120,0,,2026-05-20T03:42:15.807927+00:00
Google Play,Spotify,com.spotify.music,us,en,6a557968-1532-4ccc-8302-ea3f0c885970,buena aunque con anuncios,5,2026-05-17 18:40:15,9.1.44.2120,0,,2026-05-20T03:42:15.807927+00:00
Google Play,Spotify,com.spotify.music,us,en,24e49074-7e99-4592-a0a8-011dcaaff5b4,Love it,5,2026-05-17 18:39:42,9.1.44.2120,0,,2026-05-20T03:42:15.807927+00:00
Google Play,Spotify,com.spotify.music,us,en,3512d96b-506c-4554-a3a1-1c20d5d4afb8,nice,5,2026-05-17 18:36:46,9.1.44.2120,0,,2026-05-20T03:42:15.807927+00:00
Google Play,Spotify,com.spotify.music,us,en,ff914218-b0f1-48b2-a558-b1e4bd591cd6,perfect condolences,5,2026-05-17 18:35:49,9.1.40.1486,0,,2026-05-20T03:42:15.807927+00:00
Google Play,Spotify,com.spotify.music,us,en,d22af793-7136-4bcd-a9e0-bc5c68981f84,too much music in my ads,1,2026-05-17 18:32:26,9.0.66.655,0,,2026-05-20T03:42:15.807927+00:00
Google Play,Spotify,com.spotify.music,us,en,5964f0b4-6e2b-46c1-9895-0b6f738c9841,dont need videos,3,2026-05-17 18:28:52,9.1.44.2120,0,,2026-05-20T03:42:15.807927+00:00
Google Play,Spotify,com.spotify.music,us,en,17727853-989d-4f8f-9263-454c339c3a52,love it!!!!!,5,2026-05-17 18:19:38,9.1.44.2120,0,,2026-05-20T03:42:15.807927+00:00
Google Play,Spotify,com.spotify.music,us,en,b7fa4f52-6af0-46f8-9543-fb700706e87c,super cool,4,2026-05-17 18:19:34,9.1.42.2058,0,,2026-05-20T03:42:15.807927+00:00
Google Play,Spotify,com.spotify.music,us,en,eeb402a6-f4b7-423c-a4e9-d88ac7849d4e,"very disappointed. used to be awesome. but my account has been wiped out 2 times in the last week. the ""fix"" is log out and log back in and it's fixed 24 hours later. the 2nd time this has happened to me the ""fix"" didn't work. and support options are down.",1,2026-05-17 18:16:17,,0,,2026-05-20T03:42:15.807927+00:00
Google Play,Spotify,com.spotify.music,us,en,36aac4ff-0bb0-46a1-be1e-fd37ce04dd49,Very nice loving it,5,2026-05-17 18:16:02,,0,,2026-05-20T03:42:15.807927+00:00
Google Play,Spotify,com.spotify.music,us,en,cf2f5f31-48ec-4888-aae3-ac12f8230cea,"Being able to send to Chromecast is now broken. Edit: cleared cache, phone restart, and complete uninstall/reinstall. Down-reving fixed it. Using 9.1.44.2104",1,2026-05-17 18:15:21,9.1.44.2120,1,"Hi. Have you tried a quick reinstall? If that doesn't help, we'd recommend reaching out to our Customer Service at support.spotify.com. Just search “Contact Us”, and they'll be happy to help.",2026-05-20T03:42:15.807927+00:00
Google Play,Spotify,com.spotify.music,us,en,927e3c85-f214-41ad-b763-bab90014af42,എജ്ജാതി ഐറ്റം...,4,2026-05-17 18:12:16,9.1.44.2120,0,,2026-05-20T03:42:15.807927+00:00
Google Play,Spotify,com.spotify.music,us,en,4befd578-2750-460a-aa4d-e1cc351e3b62,Spotify has never let me down - until now. I'm paying for the premium subscription and every now and then that I try to load the app it doesn't let me in. The screen stays stuck and I'm forced to restart my phone just to be able to listen to music. Legit not getting my money's worth.,3,2026-05-17 18:11:54,9.1.44.2120,0,,2026-05-20T03:42:15.807927+00:00
Google Play,Spotify,com.spotify.music,us,en,df015a07-6b67-4955-9cb1-fcf9203353b1,nice,5,2026-05-17 18:11:04,9.1.44.2120,0,,2026-05-20T03:42:15.807927+00:00
Google Play,Spotify,com.spotify.music,us,en,f3d00e46-1b1e-4a84-a21c-f969d2b38e0a,"Why does Spotify highjack any Bluetooth button presses after opening it once, even when another app has audio playing? I open Spotify to check new artist releases, then I can't turn off the radio on my headphones unless I go into the app, then when I press play on my headphones, SPOTIFY starts playing! I ONLY use Spotify to check new releases, nothing else because of the amount of ads. Any way to turn that off completely or will I just need to delete the app and get the release info elsewhere?",1,2026-05-17 18:11:02,9.1.44.2120,0,,2026-05-20T03:42:15.807927+00:00
Google Play,Spotify,com.spotify.music,us,en,06f645f9-a3f7-4755-a77a-866dc1bd63f1,used ro love the app.now its a love with massive hate. i can NOT get my podcasts to play if i download them. i tried installing the app multiple times and everything else. still issues. plaues for 10 seconds then the app will close it self. been a issue since around the time of the last update. i miss my old spotify when it always worked.,2,2026-05-17 18:10:40,9.1.48.1656,0,,2026-05-20T03:42:15.807927+00:00
Google Play,Spotify,com.spotify.music,us,en,5c2731f7-3c5e-48ee-9f35-e7e99267f683,I use it everyday,5,2026-05-17 18:09:01,,0,,2026-05-20T03:42:15.807927+00:00
Google Play,Spotify,com.spotify.music,us,en,305172b6-5f01-4d84-b007-b703cf1980ac,"Hey, can you guys bring the old dIsplay format for the homescreen back. Also, WHAT ARE YOU DOING? The app stopped loading content for like 6 days, then it got fixed for like 2 days, and now it's not working AGAIN.",2,2026-05-17 18:06:02,9.1.48.1661,0,,2026-05-20T03:42:15.807927+00:00
Google Play,Spotify,com.spotify.music,us,en,e3209192-e443-42f0-9fa9-f0a75db2f7bd,💛,5,2026-05-17 18:05:11,9.1.44.2120,0,,2026-05-20T03:42:15.807927+00:00
Google Play,Spotify,com.spotify.music,us,en,d484a3de-3951-4ad4-9b0e-e7a4e0f6b987,greedy as hell it's useless,1,2026-05-17 17:56:31,,0,,2026-05-20T03:42:15.807927+00:00
Google Play,Spotify,com.spotify.music,us,en,d57e2219-e256-4933-b09e-49917d6e7979,"I hate the new update with ""gapless"" song play and ""crossfade"" I have turned both off but it still doesn't play to the end of the song and I don't hear the start of the new song. I like the silences between songs because it gives the songs from to BREATHE. It's too much all at once and I wish that I could go back to a previous version where this was not a thing.",1,2026-05-17 17:56:23,9.1.44.2120,0,,2026-05-20T03:42:15.807927+00:00
Google Play,Spotify,com.spotify.music,us,en,33dfecca-c4aa-4ff8-8566-8c7733949870,"I lowk love this app, I don't know how people live without it, I can't hear the music with my phone off, perfect for bike rides or working out. One thing that'll make it better is if it just doesn't go into playing other random songs after 1 song after I press a Playlist, and I'm not paying for premium, I'm not financially ready atm.",4,2026-05-17 17:53:32,9.1.44.2120,0,,2026-05-20T03:42:15.807927+00:00
Google Play,Spotify,com.spotify.music,us,en,279477ce-8718-4a5d-8b0f-4d1ab7932b09,flawless have not had any problems lots of great music.,5,2026-05-17 17:53:11,9.1.44.2120,0,,2026-05-20T03:42:15.807927+00:00
Google Play,Spotify,com.spotify.music,us,en,d4c34b15-15d0-4ecc-919f-2e367556eeae,Man shi man fr man it's ight,5,2026-05-17 17:51:54,9.1.42.2058,0,,2026-05-20T03:42:15.807927+00:00
Google Play,Spotify,com.spotify.music,us,en,974dafe1-c453-4e89-95e1-c2944ee4c4a5,I really enjoy Spotify.,5,2026-05-17 17:51:46,,0,,2026-05-20T03:42:15.807927+00:00
Google Play,Spotify,com.spotify.music,us,en,f801d364-38de-4b80-8b26-ef08bc91f6fc,Suddenly the app keeps crashing.,3,2026-05-17 17:49:45,8.9.52.552,0,,2026-05-20T03:42:15.807927+00:00
Google Play,Spotify,com.spotify.music,us,en,0009f93a-8df1-4af7-8350-ebc2ad122227,wonderful,5,2026-05-17 17:49:21,,0,,2026-05-20T03:42:15.807927+00:00
Google Play,Spotify,com.spotify.music,us,en,b71f634e-826e-479f-bf38-ad6b2df36681,i can hear music and if i dont know the song that much i can see the words,4,2026-05-17 17:49:09,9.1.42.2058,0,,2026-05-20T03:42:15.807927+00:00
Google Play,Spotify,com.spotify.music,us,en,d75d1a29-ac08-4f6b-9496-14ca1ce8c30f,good,4,2026-05-17 17:47:13,9.1.44.2120,0,,2026-05-20T03:42:15.807927+00:00
Google Play,Spotify,com.spotify.music,us,en,b0c316c8-cb7a-467f-8c22-6d2c375f610d,"If I'm paying, I should be able to opt out of 'promotional' recommendations. Being transparent about it is not enough. This is not radio. Also, we should be able to choose default home page to be just music, as I don't ever listen to podcasts.",1,2026-05-17 17:45:32,9.1.44.2120,1,,2026-05-20T03:42:15.807927+00:00
Google Play,Spotify,com.spotify.music,us,en,a0f55dcb-b8aa-4c90-ba8e-5fc77d145e31,AbbasAi🇨🇲enjoy🇳🇬🇦🇪🇶🇦,5,2026-05-17 17:44:59,9.1.44.2120,0,,2026-05-20T03:42:15.807927+00:00
Google Play,Spotify,com.spotify.music,us,en,e3bd9bb8-80fb-4a97-8510-2b2d1e91fcbe,App v poslední době skáče bezdůvodně do offline módu ze kterého se už nedostane,1,2026-05-17 17:42:56,8.6.48.796,0,,2026-05-20T03:42:15.807927+00:00
Google Play,Spotify,com.spotify.music,us,en,35361b7a-c6ec-4de0-9d97-2907496b5930,I am gay,3,2026-05-17 17:42:16,9.1.44.2120,0,,2026-05-20T03:42:15.807927+00:00
Google Play,Spotify,com.spotify.music,us,en,5d1cf142-ef20-42c2-8dab-a39128bf8c77,Why does your app suck so much on game consoles it just randomly won't work from time to time??? you know what's really annoying Lord forbid if you don't make your subscription payment on time then every time you play music through the app open your phone up to do something a warning screen pops up and says you haven't made your payment and your music stops. this is honestly and seriously the most annoying thing I've ever seen in my life!!! STOP!!,1,2026-05-17 17:37:25,9.1.44.2120,1,,2026-05-20T03:42:15.807927+00:00
Google Play,Spotify,com.spotify.music,us,en,0cb51191-d93c-496c-b0f4-8de157c4f8ef,"""something went wrong? have another go? Try again"" this is what I see every time I start Spotify on Samsung Galaxy S25+. Super unreliable - avoid!",1,2026-05-17 17:31:57,9.1.48.1661,1,,2026-05-20T03:42:15.807927+00:00
Google Play,Spotify,com.spotify.music,us,en,cbf4df7c-a2ef-4b76-9e6b-a28bacb1f39a,love it,5,2026-05-17 17:29:34,9.1.44.2120,0,,2026-05-20T03:42:15.807927+00:00
Google Play,Spotify,com.spotify.music,us,en,de91ba16-0bc4-49c2-a1d0-99b2b0433c09,I hate this app I listen to more adds then music,5,2026-05-17 17:28:48,9.1.44.2120,0,,2026-05-20T03:42:15.807927+00:00
Google Play,Spotify,com.spotify.music,us,en,54d473b0-fb75-4f78-b5fc-866cbe4613f0,"They've made the free tier completely unusable, it use to be 1 ad every half hour now its an ad after every single song. Its practically extortion and coercion. BTW I have 2 albums on spotify and I still have to pay for it. Make it make sense.",1,2026-05-17 17:22:46,9.1.44.2120,1,,2026-05-20T03:42:15.807927+00:00
Google Play,Spotify,com.spotify.music,us,en,4c93e200-eaea-4288-b890-80199e2b1640,Why remove the Cross faded also from free trial you guys are getting really greedy its sad,3,2026-05-17 17:21:56,9.1.44.2120,0,,2026-05-20T03:42:15.807927+00:00
Google Play,Spotify,com.spotify.music,us,en,8f128f6b-d070-4fb1-85a2-e2c528fd0ece,"wonderful application, really- highly recommended",5,2026-05-17 17:21:02,9.1.44.2120,0,,2026-05-20T03:42:15.807927+00:00
Google Play,Spotify,com.spotify.music,us,en,c4034196-eebf-4d50-8b9d-7535b7e2a8c1,"pointless UI changes from spotify drive me crazy. edit: I can't believe that 7 years later, I'm again complaining about the same thing. the new widget that just rolled out is significantly worse: it does literally nothing about half the time (why can't it open the app when I'm offline? I have music downloaded). There are no next/previous controls. It takes you to a different place depending on where you click, but it's completely not obvious.",1,2026-05-17 17:16:46,9.1.44.2120,4,,2026-05-20T03:42:15.807927+00:00
Google Play,Spotify,com.spotify.music,us,en,e7ecf976-fb01-4380-b5b4-e3f19b1de94d,very good,5,2026-05-17 17:16:20,9.1.44.2120,0,,2026-05-20T03:42:15.807927+00:00
Google Play,Spotify,com.spotify.music,us,en,695ae177-e065-4295-a082-6caea08e418a,"You pretty much need premium to listen to music. But it is good for making your own playlists, I listen to Spotify on Xbox and PC because the music comes out in high def. Spotify on mobile is only good for making playlists unless you have premium.",5,2026-05-17 17:16:01,9.1.48.1656,0,,2026-05-20T03:42:15.807927+00:00
Google Play,Spotify,com.spotify.music,us,en,a8de1004-cffe-4bf3-9a85-3ed2dae9810c,if it didn't cost so much I would 100% use this over everything I absolutely love the unique playlist creations and the fun that they bring to listening to music with their throwbacks or their most played songs stuff come and getting my all-time most played songs and first song was so exciting for me!,4,2026-05-17 17:14:59,9.1.40.1486,0,,2026-05-20T03:42:15.807927+00:00
Google Play,Spotify,com.spotify.music,us,en,dfa8a94a-34ba-4ae9-b57d-885c1d34c9a8,una schifezza assurda passate a Deezer che è meglio,1,2026-05-17 17:11:29,9.1.30.1993,0,,2026-05-20T03:42:15.807927+00:00
Google Play,Spotify,com.spotify.music,us,en,0aa4d237-fbaa-4f56-a9b9-1731aab96b12,dron sirketlerine para yedirmeyi bıraktığın ve ai şarkıları yasakladığın görüşürüz. simdilik yarrami ye,1,2026-05-17 17:09:32,9.0.2.459,307,,2026-05-20T03:42:15.807927+00:00
Google Play,Spotify,com.spotify.music,us,en,c7b6a1af-38e9-423b-b846-6e30b38a7f06,el premium está delicioso,5,2026-05-17 17:08:54,9.1.44.2120,1,,2026-05-20T03:42:15.807927+00:00
Google Play,Spotify,com.spotify.music,us,en,2233b8e7-acc9-46d0-8710-6856922b9f5b,"It's a good music app I will give it that much and its recommendations are also helpful but the adds are really annoying I have never seen a music app with so many add and each and every add is so frustrating, every add is literally promoting Spotify premium, after every 3 songs there is a add I mean just how desperate are these people for money 💰 Edit: You know what I lose, I bought premium today , you won Spotify",3,2026-05-17 17:08:33,9.1.44.2120,0,,2026-05-20T03:42:15.807927+00:00
Google Play,Spotify,com.spotify.music,us,en,6bdd8829-880f-4998-b0ac-41755497de92,"the music is great, just make sure the screen is turned off, life hack, less adds.",5,2026-05-17 17:03:22,9.1.44.2120,0,,2026-05-20T03:42:15.807927+00:00
Google Play,Spotify,com.spotify.music,us,en,4764e996-0db4-4959-b95f-0d7f1c8b61d4,great,4,2026-05-17 17:03:21,9.1.44.2120,0,,2026-05-20T03:42:15.807927+00:00
Google Play,Spotify,com.spotify.music,us,en,be1a160f-7658-4207-bf68-7619b811a94d,"It's a great experience overall. However, it drains my battery and it's getting pricey.",4,2026-05-17 16:58:10,9.1.44.2120,0,,2026-05-20T03:42:15.807927+00:00
Google Play,Spotify,com.spotify.music,us,en,fa4c6e8f-c73c-4518-b5d0-bf127fd45b89,good music does what it is supposed do,5,2026-05-17 16:56:18,9.1.44.2120,0,,2026-05-20T03:42:15.807927+00:00
Google Play,Spotify,com.spotify.music,us,en,8127614a-5b6a-492a-a79f-1d2debc056a0,"I've had this app for around 4 years now, it was decent, but now there are ads everywhere. The free version is barely helpful for those who are wanting to just listen to music. Ads every second, some ads are horrible and are encouraging violent and inequality for listeners. Listeners only get SIX skips every day. Scrapes basically, and turns me away from using this app. the only thing that keeps me coming back is the fact that i have multiple playlists.",2,2026-05-17 16:51:31,,0,,2026-05-20T03:42:15.807927+00:00
Google Play,Spotify,com.spotify.music,us,en,feb0dc5c-cc30-49cd-8fdc-4fa225b44511,I love this app it helps me get rid of stress 💖,5,2026-05-17 16:49:58,9.1.44.2120,0,,2026-05-20T03:42:15.807927+00:00
Google Play,Spotify,com.spotify.music,us,en,941c4106-8ea9-474d-bcb6-b136cc197e21,"may heavenly father bless the songs i listen to in jesus amazing name Amen,And,Amen...",5,2026-05-17 16:44:22,9.1.30.1993,0,,2026-05-20T03:42:15.807927+00:00
Google Play,Spotify,com.spotify.music,us,en,2a82ba21-6737-4f66-ac18-844474743157,"Spotify Premium Is What You Need ""A Must Need"" For Music Streaming 🎵 🎵",5,2026-05-17 16:30:46,9.1.44.2120,0,,2026-05-20T03:42:15.807927+00:00
Google Play,Spotify,com.spotify.music,us,en,32c74517-3003-4490-b90f-203cd77b7959,it's my favorite music app and let's you listen to anything you want.,5,2026-05-17 16:26:55,9.1.48.1656,0,,2026-05-20T03:42:15.807927+00:00
Google Play,Spotify,com.spotify.music,us,en,27cc44a8-2741-44ba-8139-b56ab424155a,nari,5,2026-05-17 16:25:40,9.1.44.2120,0,,2026-05-20T03:42:15.807927+00:00
Google Play,Spotify,com.spotify.music,us,en,6198ed29-44d8-45b5-8e2f-42a4de706e68,I love how you can create your own Playlist. I wish you got to choose the songs that play like you can on computer. edit: ex bf now pays for spotify premium. 10/10,3,2026-05-17 16:18:13,9.1.44.2120,0,,2026-05-20T03:42:15.807927+00:00
Google Play,Spotify,com.spotify.music,us,en,c97bcdae-47bb-4146-98c2-db877d50c3fe,they treat you like trash without premium,1,2026-05-17 16:16:51,9.1.44.2120,1,,2026-05-20T03:42:15.807927+00:00
Google Play,Spotify,com.spotify.music,us,en,db984a4e-c519-4d77-9777-58c296c053f7,it's good but you can't rewind your songs of your choice but after all that Spotifty is a great app,5,2026-05-17 16:16:40,9.1.44.2120,0,,2026-05-20T03:42:15.807927+00:00
Google Play,Spotify,com.spotify.music,us,en,815fabae-3515-4e27-8c77-40d11af2c8a1,well run for music lovers,5,2026-05-17 16:10:58,9.1.44.2120,0,,2026-05-20T03:42:15.807927+00:00
Google Play,Spotify,com.spotify.music,us,en,b7c634d5-e096-4f60-b38a-f09cd6d8f3e1,The best of the best.♡,5,2026-05-17 16:10:49,9.1.44.2120,0,,2026-05-20T03:42:15.807927+00:00
Google Play,Spotify,com.spotify.music,us,en,23bd2dd4-88f1-48dd-b376-fcd6890adf6d,you will love it just have premium,5,2026-05-17 16:09:40,9.1.44.2120,0,,2026-05-20T03:42:15.807927+00:00
Google Play,Spotify,com.spotify.music,us,en,06cf2e45-ba30-4418-b13e-c0d0456a70a6,Love it,5,2026-05-17 16:08:34,9.1.44.2120,0,,2026-05-20T03:42:15.807927+00:00
